Title,Description,URL,Provider,Date Published
Review: <b>ASUS</b> ROG Crosshair X870E HERO motherboard,"In the ever-evolving world of gaming hardware, the <b>ASUS</b> ROG Crosshair X870E HERO stands out as a an enthusiast product oozing innovation and performance. This motherboard, designed for the ...",https://www.guru3d.com/review/asus-rog-crosshair-x870e-hero-review/,Guru3D.com,2024-09-30T05:01:00.0000000Z
<b>ASUS</b> Zenbook S 14 (UX5406),"Digit.in is one of the most trusted and popular technology media portals in India. At Digit it is our goal to help Indian technology users decide what tech products they should buy. We do this by testing thousands of products in our two test labs in Noida and Mumbai, to arrive at indepth and unbiased buying advice for millions of Indians.",https://www.digit.in/laptops/asus-zenbook-s-14-ux5406-price.html,Digit,2024-10-04T10:08:00.0000000Z
<b>Asus</b> ROG NUC Review,"If you were just looking at the spec sheet, you’d think the <b>Asus</b> ROG NUC was some kind of beefed-up gaming laptop, as opposed to a fully-fledged gaming PC. After all, it’s powered by an Intel ...",https://www.ign.com/articles/asus-rog-nuc-review,IGN,2024-09-12T19:50:00.0000000Z
<b>Asus</b> ZenWiFi AX Mini Mesh Router Review: Too Pricy to Recommend,"Poor performance from the mesh compromises speed, especially when connecting from afar Only one spare Ethernet jack on each device The <b>Asus</b> ZenWiFi AX Mini looks great on paper. It costs $200 for ...",https://www.cnet.com/home/internet/asus-zenwifi-ax-mini-wi-fi-6-mesh-router-review/,CNET,2022-01-14T23:08:00.0000000Z
<b>Asus</b> Tinker System 3N is a fanless mini PC with a RK3566 chip and dual Gigabit Ethernet ports,"The <b>Asus</b> Tinker System 3N is a small, fanless computer with a rugged design and a set of ports and expansion options that position it as a system that can be used in industrial settings ...",https://liliputing.com/asus-tinker-system-3n-is-a-fanless-mini-pc-with-a-rk3566-chip-and-dual-gigabit-ethernet-ports/,Liliputing,2024-09-18T00:00:00.0000000Z
Topic: <b>asus</b> rog ally x,"Ars Technica has been separating the signal from the noise for over 25 years. With our unique combination of technical savvy and wide-ranging interest in the technological arts and sciences, Ars is the trusted source in a sea of information. After all, you don’t need to know everything, only what’s important.",https://arstechnica.com/tag/asus-rog-ally-x/,Ars Technica,2024-10-03T12:25:00.0000000Z
<b>Asus</b> ProArt PZ13 review: an impressive Microsoft Surface competitor,"The <b>Asus</b> ProArt PZ13 lacks the power to be your everyday computer if you’re a creative, simply because more intensive tasks require time and patience. But it can handle software such as Photoshop and Lightroom CC and breezes through web browsing ...",https://www.digitalcameraworld.com/reviews/asus-proart-pz13-review,digitalcameraworld,2024-09-10T00:00:00.0000000Z
"The Best Early Prime Day Deals on <b>Asus</b> Laptops, Desktops, and More","Buying a new laptop or desktop qualifies as a major purchase, and Amazon Prime Big Deal Days is one of the best times to pick up a major discount on your desired device.",https://www.pcmag.com/news/the-best-early-prime-day-deals-on-asus-laptops-desktops-more,PC Magazine,2024-10-07T20:35:00.0000000Z
<b>Asus</b> ROG Delta II review,"Find out more about how we evaluate games and hardware. When you think of <b>Asus</b> Republic of Gamers gear, you probably imagine neon-lit, Cyberpunk-esque motherboards, hefty GPUs, and blazing-fast ...",https://www.pcgamer.com/hardware/gaming-headsets/asus-rog-delta-ii-gaming-headset-review/,PC Gamer,2024-09-11T23:59:00.0000000Z
<b>Asus recalls product after users &#39;smell smoke</b>&#39;,<b>Asus</b> has been forced to issue a product recall after reports from some users that its motherboards were melting. Reports emerged on social media that a number of affected Z690 Hero motherboards ...,https://www.bbc.com/news/technology-59859594,BBC,2022-01-04T00:00:00.0000000Z
<b>ASUS</b> bets on aggressive retail expansion to become India&#39;s top PC brand,ASUS aims to become India&#39;s top PC brand with a 25-30% market share in two years through aggressive retail expansion. The company has tripled its market share from 6.3% in 2017 to 17.8% in 2023. ASUS plans to expand its presence to 600 districts and launch exclusive stores across India.,https://economictimes.indiatimes.com/industry/cons-products/electronics/asus-bets-on-aggressive-retail-expansion-to-become-indias-top-pc-brand/articleshow/113783824.cms,Indiatimes,2024-09-29T08:39:00.0000000Z
<b>ASUS</b> ROG Crosshair X870E Hero Motherboard Review,"The ASUS ROG Crosshair X870E Hero is a classy motherboard with rich and unique features, but as a premium board, it comes with a premium price tag.",https://www.tweaktown.com/reviews/10873/asus-rog-crosshair-x870e-hero-motherboard/index.html,TweakTown,2024-10-08T20:24:00.0000000Z
<b>Asus</b> RT-AX86U Review: The Best Wi-Fi Router for Gamers,"<b>CNET</b>’s expert staff reviews and rates dozens of new products and services each month, building on more than a quarter century of expertise. At just under $300, the RT-AX86U is a definite step up ...",https://www.cnet.com/home/internet/asus-rt-ax86u-wi-fi-6-router-review/,CNET,2020-09-25T05:36:00.0000000Z
<b>Asus</b> U56E-BBL6,"PC Magazine is your complete guide to computers, phones, tablets, peripherals and more. We test and review the latest gadgets, products and services, report technology news and trends, and provide shopping advice and price comparisons.",https://au.pcmag.com/asus-u56e-bbl6,PC Magazine,2024-10-04T03:22:00.0000000Z
"Score An <b>ASUS</b> Windows Laptop For $109, HIsense 85&quot; TV For $799 And More Great Deals","It&#39;s not a barn burner, but $109 for a Windows laptop is about as cheap as it gets, especially from a name brand (ASUS).",https://hothardware.com/news/windows-laptop-109-hisense-85-tv-799-great-deals,HotHardware,2024-10-02T14:41:00.0000000Z
<b>ASUS</b> Introduces All-New Intel Xeon 6 Processor Servers,"World-class expertise and engineering combine to deliver next-generation servers ready to empower high-performance computing, peak performance and maximum utilization SINGAPORE - Media OutReach Newswire - 26 September 2024 - ASUS today announced its all-new line-up of Intel® Xeon® 6 processor-powered servers ,",https://www.asiaone.com/business/asus-introduces-all-new-intel-xeon-6-processor-servers,Asia One,2024-09-26T02:30:00.0000000Z
Fix <b>ASUS Smart Gesture not working on Windows</b> PC,"There’s a good chance that your <b>ASUS</b> Smart Gesture software is incompatible with your system, which can cause this issue. In this case, you can try to uninstall the current <b>ASUS</b> Smart Gesture ...",https://www.thewindowsclub.com/asus-smart-gesture-not-working,TWCN Tech News,2020-03-07T05:03:00.0000000Z
"Unable to <b>install Synaptics, ASUS, etc, Touchpad drivers</b> on Windows 11","If you cannot <b>install Synaptics, ASUS, etc, Touchpad drivers</b>, and you see Cannot complete the device driver installation wizard error message, then this post shows ...",https://www.thewindowsclub.com/unable-to-install-touchpad-drivers,TWCN Tech News,2020-11-13T13:51:00.0000000Z
electrified/<b>asus</b>-wmi-sensors,Thanks to @0lvin this driver has been merged into the kernel mainline. https://git.kernel.org/pub/scm/linux/kernel/git/torvalds/linux.git/tree/drivers/hwmon/<b>asus</b>_wmi ...,https://github.com/electrified/asus-wmi-sensors,GitHub,2018-12-16T21:51:00.0000000Z
sammilucia/<b>ASUS</b>-G14-Debloating,"Originally posted as the <b>ASUS</b> G14 bloatware cleanup guide here. This guide removes all possible <b>ASUS</b> software (MyASUS, Armoury Crates, and other unnecessary files) while still leaving critical functions intact. I&#39;ve seen many posts on how to remove <b>ASUS</b> ...",https://github.com/sammilucia/ASUS-G14-Debloating,GitHub,2021-11-14T20:18:00.0000000Z
This upgradeable <b>Asus</b> Vivobook laptop is just $220 today,"This Asus Vivobook is almost half off today. With decent RAM and SSD upgrades, you&#39;d still be at under $300 for a respectable laptop config!",https://www.pcworld.com/article/2474462/this-upgradeable-asus-vivobook-laptop-is-just-220-today.html,PC World,2024-10-01T15:11:00.0000000Z
