Title,Description,URL,Provider,Date Published
<b>ASUS</b> Zenbook S14 (UX5406SA) review: The sleek ultraportable with AI capabilities,The ASUS Zenbook S 14 (UX5406SA) is not just a powerful ultraportable laptop; it is one of the pioneer in the world of AI-enhanced computing. It,https://dailypost.ng/2024/10/08/asus-zenbook-s14-ux5406sa-review-the-sleek-ultraportable-with-ai-capabilities/,Daily Post Nigeria,2024-10-08T21:45:00.0000000Z
"The Best Prime Day Deals on <b>Asus</b> Laptops, Desktops, and More","Buying a new laptop or desktop qualifies as a major purchase, and Amazon Prime Big Deal Days is one of the best times to pick up a major discount on your dream device.",https://www.pcmag.com/news/asus-deals-october-amazon-prime-day-2024,PC Magazine,2024-10-08T14:46:00.0000000Z
<b>ASUS</b> Zenbook S 14 (UX5406SA) Redefines Personal Computing with AI-Powered Performance,"The world of laptops is fast-evolving, and ASUS has taken another bold step forward with the release of the Zenbook S 14 (UX5406SA), a 14-inch AI-powered ultrabook. It’s more than just a portable machine;",https://www.vanguardngr.com/2024/10/asus-zenbook-s-14-ux5406sa-redefines-personal-computing-with-ai-powered-performance/,Vanguard,2024-10-08T18:48:00.0000000Z
<b>ASUS</b> Zenbook S14 UX5406SA Review: The Best Ultrabook of 2024?,"The ASUS Zenbook S14 combines sleek design with impressive performance and battery life, making it the top ultrabook selection of 2024.",https://techweez.com/2024/10/07/asus-zenbook-s14-ux5406sa-review-the-best-ultrabook-of-2024/,Techweez,2024-10-07T12:25:00.0000000Z
Hands-On with the <b>Asus</b> ROG Ally X,"The Asus ROG Ally X delivers on both performance and quality of life upgrades to the company’s flagship handheld, and is probably the best handheld gaming PC for the money currently on the market. It is available to buy now via Asus priced at £799 GBP ( $799 USD ).",https://hypebeast.com/2024/10/asus-rog-ally-x-long-term-review,Hypebeast,2024-10-07T02:12:00.0000000Z
<b>Asus</b> Tablets,"ASUSTeK Computer Inc., known as <b>ASUS</b>, is a Taiwanese multinational computer hardware and electronics company was founded in 1989 in Taiwan. <b>ASUS</b> is one of the world&#39;s largest computer hardware companies. Its products include desktops, PC peripherals ...",https://www.gadgets360.com/tablets/asus-tablets,gadgets360,2020-08-12T23:55:00.0000000Z
<b>ASUS</b> Vivobook: AI So ‘Pandai’ You’ll Wonder How You Lived Without It!,"The ASUS Vivobook S 15 is super fast! It can find your photos, emails, or files quicker than you can say “copy-paste.” During video calls, it can do live translations for you—so you can finally have smooth conversations without the language barrier. And it even has voice command so you can feeling-feeling like you’re Iron Man.",https://www.therakyatpost.com/living/2024/09/27/asus-vivobook-ai-so-pandai-youll-wonder-how-you-lived-without-it/,The Rakyat Post,2024-09-27T09:34:00.0000000Z
Give Up on the PS5 Pro and Welcome in a Powerful <b>ASUS</b> Gaming Laptop for Not Much More This Prime Day,The ASUS ROG Strix G16 gaming laptop is 21% off for Prime Day. Dominate the gaming competition by taking advantage of Amazon Prime deals.,https://gizmodo.com/give-up-on-the-ps5-pro-and-welcome-in-a-powerful-asus-gaming-laptop-for-not-much-more-this-prime-day-2000509249,Gizmodo,2024-10-08T21:40:00.0000000Z
AH Real Deal: <b>ASUS</b> ROG Strix G16 (2024) gaming laptop hits lowest-ever price,"If you&#39;re in the market for a new gaming laptop, you&#39;re in luck. The ASUS ROG Strix G16 (2024) has reached its lowest-ever price on Amazon, which makes it",https://www.androidheadlines.com/2024/10/asus-rog-strix-g16-2024-gaming-laptop-amazon-prime-day.html,Android,2024-10-08T14:37:00.0000000Z
"Amazon Prime Day Chromebook deals are here, with great discounts on laptops from <b>Asus</b>, Lenovo, Acer, and more","Lenovo IdeaPad 3i Chromebook: was $289.99 now $254 at Amazon A modest 12% discount on an excellent Chromebook, the IdeaPad 3i from Lenovo in Abyss Blue offers a Full HD display and 8GB of RAM to ensure that ChromeOS runs buttery-smooth - as well as packing that trusted Lenovo build quality, too.",https://www.techradar.com/computing/laptops/amazon-prime-day-chromebook-deals-are-here-with-great-discounts-on-laptops-from-asus-lenovo-acer-and-more,TechRadar,2024-10-08T15:15:00.0000000Z
This budget gaming laptop from <b>Asus</b> just got a $200 price cut,"This Asus TUF F15 comes with an RTX 4060 and an Intel Core i7-13620H, all for just $999, so be sure to check out these deal before it expires.",https://www.digitaltrends.com/computing/asus-tuf-f15-deal-walmart-october-2024/,Digital Trends,2024-10-04T19:20:00.0000000Z
The best <b>Asus</b> gaming laptops 2024,"Whether you&#39;re after a portable powerhouse or something a little chunkier, the best <b>Asus</b> gaming laptops can do it all - and in style. Between the slimmer Zephyrus line and the more powerful Strix ...",https://www.gamesradar.com/the-best-asus-gaming-laptops/,GamesRadar+,2024-09-09T16:17:00.0000000Z
<b>ASUS</b> ROG Ally X Review: The king of handhelds,"Handheld gaming has been making a comeback in a big way over the past year or two thanks to the Steam Deck and ROG Ally, and while both of those are",https://www.androidheadlines.com/2024/10/asus-rog-ally-x-review-the-king-of-handhelds.html,Android,2024-10-01T18:45:00.0000000Z
"Amazon Sale 2024: Up to 47% off on laptops on top brands like HP, Dell, <b>ASUS</b> and more","This Amazon Sale 2024 brings a variety of exciting deals on laptops across different categories to suit every need and budget. Whether you&#39;re looking for basic laptops for everyday tasks like browsing and emails,",https://economictimes.indiatimes.com/top-trending-products/news/amazon-sale-2024-up-to-47-off-on-laptops-on-top-brands-like-hp-dell-asus-and-more/articleshow/114050430.cms,Indiatimes,2024-10-08T12:56:00.0000000Z
<b>Asus</b> ZenFone 9,<b>Asus</b> ZenFone 9 mobile was launched on 28th July 2022. The phone comes with a 120 Hz refresh rate 5.90-inch touchscreen display offering a resolution of 1080x2400 pixels (HD+) and an aspect ratio of 20:9. The display sports Gorilla Glass for protection.<b>Asus</b> ...,https://www.gadgets360.com/asus-zenfone-9-price-in-india-111636,gadgets360,2022-07-28T00:00:00.0000000Z
<b>ASUS IoT</b>,The <b>ASUS IoT</b> was established in 2019 with a mission to become a trusted provider of embedded solutions. We have assembled a world-class team of IoT professionals who are dedicated to developing ...,https://www.linkedin.com/showcase/asus-iot,LinkedIn,2020-08-07T17:35:00.0000000Z
"<b>Asus</b> ProArt PZ13 And Vivobook S15 OLED Laptops Launched In India: Price, Features","<b>Asus</b> has expanded its laptop lineup with the launch of two new laptops in India, the ProArt PZ13 and Vivobook S 15 OLED. Both the devices are powered by Qualcomm Snapdragon X Plus processors. The new laptops aim to deliver exceptional performance with AI ...",https://www.news18.com/tech/asus-proart-pz13-and-vivobook-s15-oled-laptops-launched-in-india-price-features-9044207.html,CNN-News18,2024-09-11T05:21:00.0000000Z
"Amazon Great Indian Festival Sale 2024 brings massive saving on laptops under ₹60000 from HP, Dell, MSI, <b>Asus</b> and more","Amazon Great Indian Festival sale 2024 is bringing you deals on laptops under ₹60,000 that you can not miss. Choose from models for gaming, working, or casual usage at highly discounted prices during the Amazon sale.",https://www.msn.com/en-in/money/news/amazon-great-indian-festival-sale-2024-brings-big-offers-on-laptops-under-60000-from-hp-dell-msi-asus-and-more/ar-AA1rwupC,Live Mint on MSN.com,2024-10-03T23:27:00.0000000Z
Best handheld gaming PC in 2024,"Read our Steam Deck review. While we didn’t get the OLED display that was widely rumored, the <b>Asus</b> ROG Ally X made big changes to virtually every other aspect of its design and came out the ...",https://www.pcgamesn.com/best-handheld-gaming-pc,PCGamesN,2024-09-10T00:00:00.0000000Z
"Best early laptop deals for October Prime Day 2024: Gaming notebooks, 2-in-1s, and more","You can make a free account and the interface is pretty easy to navigate. Let’s use the <b>Asus</b> VivoBook 16 as an example. Plug the ASIN, which is the part of the URL that starts with the letter B ...",https://www.pcworld.com/article/2390522/best-laptop-deals-amazon-prime-day-2024.html,PC World,2024-09-24T06:32:00.0000000Z
<b>ASUS</b> Zenbook S14 review: A showpiece for Intel’s Lunar Lake AI PC chips,"The Zenbook S 14, powered by Intel’s new Lunar Lake chips, is an attractive ultraportable that’s ready to tackle AI-infused features. It’s an incredible value, especially with an OLED screen, and it offers stunning battery life.",https://sg.news.yahoo.com/asus-zenbook-s14-review-a-showpiece-for-intels-lunar-lake-ai-pc-chips-171642261.html,Yahoo News Singapore,2024-09-30T17:21:00.0000000Z
Intel Lunar Lake outperforms Steam Deck and <b>Asus</b> ROG Ally in real-world gaming benchmarks,"According to real-world benchmarks published by Geekerwan, a Lenovo Yoga laptop powered by the Intel Core Ultra 7 258V was noticeably faster than both the Steam",https://www.techspot.com/news/105032-intel-lunar-lake-outperforms-steam-deck-asus-rog.html,TechSpot,2024-10-07T14:39:00.0000000Z
<b>ASUS</b> ROG Phone 8 Review: The Gaming Smartphone’s Gamble,Ewan Spence covers the digital worlds of mobile technology. The <b>ASUS</b> ROG Phone 8 Pro reviewed here ticks many boxes that transform an Android smartphone into a gaming phone. But <b>ASUS</b> has decided ...,https://www.forbes.com/sites/ewanspence/2024/01/16/asus-rog-phone-8-pro-review-premium-specs-flagship/,Forbes,2024-01-16T12:44:00.0000000Z
<b>Asus</b> ROG Phone 8 now cheaper with National Day Deals: Here’s what you need to know,"With the National Day promo, the <b>Asus</b> ROG Phone 8 will be sold at a discounted price of RM3,599. This is RM400 lower than its original RM3,999 price tag. To enjoy this discount, you will have to purchase the ROG Phone 8 either through <b>Asus</b>’ Authorised ...",https://soyacincau.com/2024/08/26/asus-rog-phone-8-now-cheaper-with-national-day-deals-heres-what-you-need-to-know/,SoyaCincau,2024-08-25T23:59:00.0000000Z
"<b>ASUS</b> ProArt PX13 Review: Small, powerful, insanely creative","Review: ASUS has launched the ProArt PX13, a powerful laptop for creatives, featuring AMD&#39;s Ryzen AI 9 HX 370 chipset, a 13.3-inch 3K OLED display, and NVIDIA graphics. Priced at ₹179,999, it combines performance with portability for demanding workflows.",https://www.cnbctv18.com/technology/asus-proart-px13-review-small-powerful-insanely-creative-19487743.htm,cnbctv18,2024-10-05T07:32:00.0000000Z
<b>Asus</b> launches ProArt PZ13 2-in-1 tablet with Snapdragon X Plus for $1100 and up,"The <b>Asus</b> ProArt PZ13 is a 13.3 inch Windows 11 tablet with a 2880 x 1800 pixel touchscreen OLED display, support for pressure-sensitive pen input and a detachable keyboard, and a Qualcomm ...",https://liliputing.com/asus-launches-proart-pz13-2-in-1-tablet-with-snapdragon-x-plus-for-1100-and-up/,Liliputing,2024-09-04T09:31:00.0000000Z
Design You Can Feel,"Dezeen has teamed up with <b>ASUS</b> Zenbook to curate a major exhibition during London Design Festival called Design You Can Feel. Taking place in Shoreditch from 17 to 22 September 2024, the Design ...",https://www.dezeen.com/designyoucanfeel/,Dezeen,2024-09-04T00:00:00.0000000Z
This new $3499 notebook falls short of great expectations,"Why didn’t you ask? We can do that! They should have done it years ago. Case in point, the <b>Asus</b> Zenbook S 16 OLED, a super-slim, super-light, 16-inch Windows laptop with an advertised battery ...",https://www.afr.com/technology/new-asus-notebook-falls-short-of-great-expectations-20240912-p5k9z0,The Australian Financial Review,2024-09-17T15:04:00.0000000Z
"The <b>Asus</b> ROG Ally is the best gaming handheld I&#39;ve ever owned, and it&#39;s on sale this Prime Day – but it&#39;s not an Amazon discount","The ROG Ally is a fantastically-designed little handheld that manages to pack a lot of power into its dinky chassis thanks to the AMD Z1 Extreme chip, letting you play virtually any game from any digital PC storefront; you might need to crank the graphics down a little for Cyberpunk 2077, mind.",https://www.techradar.com/seasonal-sales/the-asus-rog-ally-is-the-best-gaming-handheld-ive-ever-owned-and-its-on-sale-this-prime-day-but-its-not-an-amazon-discount,TechRadar,2024-10-08T16:55:00.0000000Z
<b>Asus</b> opens 300th store in India,"Spanning over 700 sq. ft. of retail space, the new Asus store is located at Phoenix Mall of Asia, Byatarayanapura",https://www.indiaretailing.com/2024/10/04/asus-opens-300th-store-in-india/,indiaretailing,2024-10-04T08:45:00.0000000Z
"The <b>ASUS</b> ROG Strix G16 with GeForce RTX 4060 is $1,100 today — usually $1,400",Thanks to a Prime Big Deal Days offer the ASUS ROG Strix G16 with RTX 4060 gaming laptop is available at an incredible discount.,https://www.digitaltrends.com/computing/prime-big-deal-days-asus-rog-strix-g16-gaming-laptop-deal-2024/,Digital Trends,2024-10-08T21:30:00.0000000Z
"<b>Asus</b> Vivobook, ExpertBook B3: Two compelling laptops for home and office","At IFA Berlin, Asus expanded its portfolio with the Snapdragon X Plus (Qualcomm’s newest, and cheapest laptop chip) variant of the Vivobook S15. A few months prior, a business laptop—Asus ExpertBook B3 (B3404)—came out of the assembly line.",https://www.livemint.com/mint-lounge/business-of-life/asus-vivobook-expertbook-b3-review-11727942545134.html,Mint,2024-10-05T18:32:00.0000000Z
<b>ASUS</b> celebrates one-year anniversary of NUC portfolio takeover,"<b>ASUS</b> took over the NUC portfolio from Intel last year, and now, <b>ASUS</b> is celebrating this milestone by promising new innovations for the product lineup. The NUC lineup was started by Intel, and it stands for Next Unit of Computing. Essentially, it’s a ...",https://www.ungeek.ph/2024/10/asus-celebrates-one-year-anniversary-of-nuc-portfolio-takeover/,ungeek,2024-10-08T00:00:00.0000000Z
<b>Asus</b> ROG Ally X: Here’s Where To Get The Handheld Gaming PC Online,"With the rise of handheld gaming with the Nintendo Switch OLED and Valve Steam Deck, computer company <b>Asus</b> released a new portable PC that makes it possible to play more of your favorite games on ...",https://www.billboard.com/culture/product-recommendations/asus-rog-ally-x-buy-online-1235740009/,Billboard,2024-09-19T00:00:00.0000000Z
Here&#39;s how the <b>Asus</b> ROG Ally Xs battery life compares to the ROG Ally we tested both,"W hen Asus announced the Asus ROG Ally X this summer, the thing that caught our eye was the handheld&#39;s 80Wh battery capacity. That&#39;s double the 40Wh battery you&#39;ll find inside the",https://www.msn.com/en-us/news/technology/heres-how-the-asus-rog-ally-xs-battery-life-compares-to-the-rog-ally-we-tested-both/ar-AA1rNzdK,XDA Developers on MSN.com,2024-10-06T13:00:13.0000000Z
"Where to pre-order the new ROG Ally X, <b>Asus</b>&#39; upgraded Steam Deck rival",The biggest stories of the day delivered to your inbox.,https://mashable.com/article/asus-rog-ally-x-preorder,Mashable,2024-06-03T00:00:00.0000000Z
<b>ASUS</b> Vivobook S15 (Qualcomm) Review: Premium looking laptop with long battery life and smooth performance,"The Vivobook S15, powered by the Qualcomm Snapdragon X Elite chip is paired with 16GB of LPDDR5X RAM. I used the laptop for a week, with decent usage for everyday tasks, and here is my honest review of the laptop.",https://www.indiatvnews.com/technology/reviews/asus-vivobook-s15-qualcomm-review-premium-looking-laptop-with-long-battery-life-and-smooth-performance-2024-10-08-956147,India TV,2024-10-08T13:35:00.0000000Z
<b>Asus</b> Zenfone 11 Ultra Review: The Zenfone Grows Up,"Ewan Spence covers the digital worlds of mobile technology. While it might be part of the Zenfone brand, the new <b>Asus</b> Zenfone 11 Ultra is not a small phone. The Taiwanese manufacturer is making a ...",https://www.forbes.com/sites/ewanspence/2024/03/14/asus-zenfone-11-ultra-review-ai-camera-smart-button-specs/,Forbes,2024-03-14T13:36:00.0000000Z
"<b>Asus</b> Vivobook S15 OLED First Impressions: I Needed Battery Power On The Run, And I Got It","Covering a trade show like IFA 2024 is not easy. There&#39;s a lot of walking, there&#39;s a lot of shaking hands (or in my case fist bumps) and, for a site like SlashGear, there&#39;s a lot of writing.",https://www.slashgear.com/1664562/asus-vivobook-s15-oled-hands-on-first-impressions-power-portability/,SlashGear,2024-09-13T00:00:00.0000000Z
"<b>ASUS</b> Chromebook Plus CX34 Review: Strong Performance, Muted Display","It offers excellent performance and performs basic tasks without breaking a sweat, making it a solid pick for users looking for an affordable premium Chromebook. However, the washed-out colors and dull display in outdoor settings make it less ideal for color-sensitive tasks and watching media outdoors.",https://techpp.com/2024/10/08/asus-chromebook-plus-cx34-review/,Techno-Science.net,2024-10-08T11:48:00.0000000Z
<b>ASUS</b> starts pre-orders for Intel Core Ultra-powered Zenbook S 14 AI PC,"Taiwanese electronics brand <b>ASUS</b> has commenced pre-bookings for the new <b>ASUS</b> Zenbook S 14 laptop. Powered by the Intel Core Ultra processors (Series 2) with a dedicated neural processing unit (NPU) for artificial intelligence tasks, the laptop will ...",https://www.business-standard.com/technology/gadgets/asus-starts-pre-orders-for-intel-core-ultra-powered-zenbook-s-14-ai-pc-124091900687_1.html,Business Standard,2024-09-19T20:48:00.0000000Z
<b>ASUS</b> Sets 7.55 GHz Overclocking Record with ROG Crosshair X870E HERO and AMD Ryzen 9 9950X,ASUS has established a new benchmark in processor performance by overclocking the AMD Ryzen 9 9950X to 7.55 GHz using its ROG Crosshair X870E HERO motherboard.,https://www.guru3d.com/story/asus-sets-755-ghz-overclocking-record-with-rog-crosshair-x870e-hero-and-amd-ryzen-9-9950x/,Guru3D.com,2024-09-30T17:24:00.0000000Z
Prime Big Deal Days saves you $45 on one of our favorite midrange motherboards from <b>Asus</b>,"The Asus TUF Gaming Z790-Plus WiFi motherboard is a solid midranger for the LGA 1700 socket, with plenty of power delivery, fast networking connectivity, and best of all - a $45 price reduction. Building a new PC should be an enjoyable experience,",https://www.msn.com/en-us/news/technology/prime-big-deal-days-saves-you-45-on-one-of-our-favorite-midrange-motherboards-from-asus/ar-AA1rUSxh,XDA Developers on MSN.com,2024-10-08T10:15:14.0000000Z
Best <b>ASUS</b> Vivobook Laptops: For Students And Professionals,"Best ASUS Vivobook Laptops: The Vivobook 16 laptop is renowned for its high-performance features, such as the Intel Iris Xe graphics card, which can produce 8K, 4k, and 1080p graphics for gaming. With its large SSD and flat-lay hinge, the Asus Vivobook 16 laptop is an excellent option for both students and working professionals.",https://www.herzindagi.com/top-deals/laptop/best-asus-vivobook-laptops-suitable-for-students-and-professionals-article-1002381,Her Zindagi Hindi,2024-10-02T06:01:00.0000000Z
"NVIDIA x MediaTek AI PC SoC to arrive in 2H 2025: will be used by Dell, Lenovo, HP, and <b>ASUS</b>","NVIDIA and MediaTek to unveil their highly-anticipated AI PC processor in the second half of 2025: will be inside of Dell, Lenovo, HP, ASUS products.",https://www.tweaktown.com/news/100983/nvidia-mediatek-ai-pc-soc-to-arrive-in-2h-2025-will-be-used-by-dell-lenovo-hp-and-asus/index.html,TweakTown,2024-10-09T05:10:00.0000000Z
<b>Asus</b> 65W USB-C GaN charger review: A durable and power-efficient device,"The Asus 65W USB-C GaN charger feels durable, as the company claims the device has undergone a 10,000-cycle insert-and-removal and a 3,000-cycle cable bend test.",https://www.zeebiz.com/technology/reviews/news-asus-65w-usb-c-gan-charger-review-a-durable-and-power-efficient-device-319672,Zee Business,2024-10-04T10:53:00.0000000Z
"<b>Asus</b> TUF Gaming A16 Advantage Edition review: all AMD, but is it any good?","Asus&#39;s latest affordable gaming laptop uses all-AMD hardware to mostly good effect, including both decent gaming performance and great battery life. But it&#39;s still a toughsell next to the more obvious Nvidia RTX-powered options.",https://www.msn.com/en-us/news/other/asus-tuf-gaming-a16-advantage-edition-review-all-amd-but-is-it-any-good/ar-AA1rIsqH,TechRadar on MSN.com,2024-10-04T20:02:35.0000000Z
Edge AI Computing New <b>ASUS</b> IoT’s New Tinker Board 3 and System 3N,"ASUS IoT has recently unveiled two innovative Edge AI products, the Tinker System 3N and the Tinker Board 3, both designed to meet the diverse and growing",https://www.geeky-gadgets.com/edge-ai-computing/,Geeky Gadgets,2024-10-01T11:50:00.0000000Z
"Flipkart Big Billion Days sale is live: HP, <b>Asus</b>, Acer laptops as low as Rs 10,000","The sale is live for all now, starting September 27 to October 6. Flipkart is offering several eye-catching deals on laptops, with the starting price is as low as Rs 10,000. Read on to find more.",https://www.indiatoday.in/technology/news/story/flipkart-big-billion-days-sale-is-live-hp-asus-acer-laptops-as-low-as-rs-10000-2607154-2024-09-27,India Today,2024-09-27T03:52:00.0000000Z
Deal: The <b>ASUS</b> Vivobook 14 laptop is too affordable for what you get,"Are you looking for a casual laptop? This deal on the ASUS Vivobook 14 laptop is one you can&#39;t miss, but you have to act quickly.",https://www.androidauthority.com/asus-vivobook-14-deal-2-3486624/,Android Authority,2024-10-01T18:54:00.0000000Z
<b>ASUS</b> ROG Ally X Review: What The Original Should’ve Been,"The <b>ASUS</b> ROG Ally X, as a follow-up, feels more than just a refresh of the original gaming handheld that launched last year. Having spent some time with it as my daily driver, it feels more of an exercise in fine-tuning, tweaking, and fixing the ...",https://www.lowyat.net/2024/328851/asus-rog-ally-x-review/,Lowyat.net,2024-09-11T13:27:00.0000000Z
<b>ASUS</b> And Merlin Computers Launch New Range For Business In Malta,"ASUS recently unveiled its latest product range at an exclusive event held at Samizu, Malta. Organised with local representatives Merlin Computers Ltd., this occasion brought together top clients, influential figures from the technology sector and key stakeholders,",https://lovinmalta.com/malta/asus-and-merlin-computers-launch-new-range-for-business-in-malta/,Lovin Malta,2024-10-02T14:29:00.0000000Z
"4K OLED, AMD and NVIDIA AI power, and unique creative features make this <b>ASUS</b> laptop very special","The ASUS ProArt P16 (2024) is a gorgeous and immensely powerful laptop aimed directly at creatives, artists, and engineers. It packs the latest AMD and NVIDIA hardware and AI capabilities, the 4K OLED display is wonderful,",https://www.msn.com/en-us/news/technology/4k-oled-amd-and-nvidia-ai-power-with-unique-creative-features-make-this-asus-laptop-very-special/ar-AA1rN17R,Windows Central on MSN.com,2024-10-06T20:00:00.0000000Z
"<b>Asus</b> ROG Ally, a Steam Deck rival, is getting a big update. Here’s what we know.",The biggest stories of the day delivered to your inbox.,https://mashable.com/article/asus-rog-ally-x-specs-announced,Mashable,2024-05-09T23:59:00.0000000Z
"<b>ASUS</b> ROG, TUF Gaming, Prime, ProArt X870E / X870 motherboards now available in the Philippines","ASUS recently announced that its new ROG, TUF Gaming, Prime, and ProArt X870E / X870 motherboards are now available in the Philippines.",https://www.ungeek.ph/2024/10/asus-rog-tuf-gaming-prime-proart-x870e-x870-motherboards-now-available-in-the-philippines/,ungeek,2024-10-01T09:49:00.0000000Z
<b>Asus</b> ROG Ally X Review,"Please verify your email address. While the naming might suggest that the ROG Ally X is the next generation of <b>Asus</b>’ PC gaming handheld, it’s more like the ...",https://gamerant.com/asus-rog-ally-x-review/,Game Rant,2024-09-02T00:00:00.0000000Z
<b>Asus</b> ROG Ally Review,"Editor&#39;s Note: We&#39;ve also reviewed the <b>Asus</b> ROG Ally X, which is the latest in the ROG Ally line. The <b>Asus</b> ROG Ally is the next challenger in line when it comes to handheld gaming PCs. This new ...",https://www.ign.com/articles/asus-rog-ally-review,IGN,2023-05-11T14:00:00.0000000Z
<b>Asus</b> NitroPath RAM slots: What makes them stand out?,Asus announced its NitroPath DRAM technology during Gamescom back in August. NitroPath is a rethink of the traditional memory slot design that uses shorter gold finger,https://www.techspot.com/news/105053-asus-nitropath-ram-slots-what-makes-them-stand.html,TechSpot,2024-10-08T16:21:00.0000000Z
"Empty RAM slots can harm DRAM performance — <b>Asus</b> NitroPath slots curb electrical interference, gain 400 MT/s, and are 40% shorter","Asus&#39; new NitroPath DRAM slots improve speeds by curbing electrical interference from unpopulated RAM slots, allowing for 400 MT/s increases in RAM overclocks. Der8auer helps explain the tech and why it is not found on some new Asus boards.",https://www.yahoo.com/tech/empty-ram-slots-harm-dram-180900479.html,Yahoo,2024-10-08T08:21:00.0000000Z
<b>ASUS</b> ProArt PZ13 Snapdragon X Windows Tablet hands on review,"The <b>Asus</b> ProArt PZ13 is a versatile 3-in-1 Windows tablet that caters to a wide range of professional and creative needs. Powered by the Snapdragon X+ ARM CPU, this device offers robust ...",https://www.geeky-gadgets.com/asus-proart-pz13-windows-tablet/,Geeky Gadgets,2024-09-11T23:59:00.0000000Z
<b>Asus</b>&#39; ProArt PZ13 makes me excited for the future of ARM PCs,You’ve reached your account maximum for followed topics. The <b>Asus</b> ProArt PZ13 is an ARM-based Windows 11 2-in-1 hybrid device. The tablet can be transformed into a laptop-style form factor via ...,https://www.pocket-lint.com/asus-proart-pz13-review/,Pocket-lint,2024-09-18T00:00:00.0000000Z
