Title,Description,URL,Provider,Date Published
"Circuit Board Maker <b>Jabil</b> Stock Soars on Strong Results, Buyback",Jabil beat fourth-quarter profit and sales estimates on the soaring demand for artificial intelligence infrastructure products.,https://www.investopedia.com/circuit-board-maker-jabil-stock-soars-on-strong-results-buyback-8719016,Investopedia,2024-09-26T18:23:00.0000000Z
<b>Jabil</b> Fiscal 4Q Revenue Slips But Beats Estimates,Jabil forecast revenue between $6.3 billion and $6.9 billion as well as adjusted earnings per share of $1.65-$2.05 in the first quarter of fiscal 2025. Analysts polled by FactSet expected $6.49 billion in revenue and $1.83 a share in adjusted earnings.,https://www.marketwatch.com/story/jabil-fiscal-4q-revenue-slips-but-beats-estimates-ae249ceb,MarketWatch,2024-09-26T11:52:00.0000000Z
Apple Hosur plant fire: Tata Electronics to resume partial ops from today,"Tata Electronics announced its plans to resume partial operations today at its Hosur plant in Tamil Nadu after a major fire erupted on September 28, which brought production to a standstill. This facility manufactures components for Apple iPhones.",https://www.fortuneindia.com/enterprise/apple-hosur-plant-fire-tata-electronics-to-resume-partial-ops-from-today/118613,Fortune India,2024-10-03T07:15:00.0000000Z
"<b>Jabil</b>&#39;s Q4: Earnings Beat, $1B Buyback, FY25 Guidance And More","Jabil Inc (NYSE: JBL) reported fourth-quarter revenue of $6.96 billion, down by 17.7% year-on-year, beating the analyst consensus estimate of $6.59 billion. The print manufacturing company’s adjusted EPS of $2.",https://sg.finance.yahoo.com/news/jabils-q4-earnings-beat-1b-123207994.html,Yahoo Finance,2024-09-26T08:32:00.0000000Z
Opinion | What Makes Maharashtra India’s No. 1 Investment Destination,"From attracting major players in electric vehicles and semiconductors to leveraging national initiatives like PLIs, Maharashtra is proactively building an ecosystem for future industries, cementing it",https://www.news18.com/opinion/opinion-what-makes-maharashtra-indias-no-1-investment-destination-9073207.html,CNN-News18,2024-10-04T08:33:00.0000000Z
Apple supplier <b>Jabil</b> to set up South India plant with $238 million investment,"NEW DELHI : Electronic components maker <b>Jabil</b> will set up a manufacturing plant in India&#39;s southern state of Tamil Nadu with an investment of about 20 billion rupees ($238.2 million), the state&#39;s ...",https://www.channelnewsasia.com/business/apple-supplier-jabil-set-south-india-plant-238-million-investment-4598091,Channel NewsAsia Singapore,2024-09-10T05:25:00.0000000Z
Intel Offloads Silicon Photonics Product Line To <b>Jabil</b>,"The move, part of a long-term plan to focus on core chip-making technology that has seen at least 10 divestitures in the last 2.5 years, will send Intel’s current silicon photonics module ...",https://www.crn.com/news/components-peripherals/intel-divests-another-non-strategic-business-this-time-to-jabil,CRN,2023-10-30T06:05:00.0000000Z
"<b>JABIL</b> to invest ₹2,000 crore in electronics manufacturing facility at Manapparai, create 5,000 Jobs","<b>JABIL</b>, the $35 billion key supplier to global giants like Apple, Cisco, and HP, will establish an electronics manufacturing facility in Manapparai near Trichy with an investment of ₹2,000 crore ...",https://www.thehindubusinessline.com/info-tech/jabil-to-invest-2000-crore-in-electronics-manufacturing-facility-in-manapparai-creating-5000-jobs/article68624705.ece,Business Line,2024-09-10T10:25:00.0000000Z
"Northern Kentucky business plans to close facility, lay off local employees","FLORENCE, Ky. (WKRC) - Jabil Inc. is permanently closing one of its local facilities. The Jabil Florence - CAMS facility located on Ted Bushelman Blvd. will close its doors December 6, according to a notification to the state. Jabil is moving the operation out of state.",https://www.msn.com/en-us/money/companies/northern-kentucky-business-plans-to-close-facility-lay-off-local-employees/ar-AA1rTLHx,WKRC Cincinnati on MSN.com,2024-10-08T13:59:36.0000000Z
<b>Jabil</b>’s Positive Outlook: Strong Financials and Strategic Restructuring Fuel Buy Rating,Mark Delaney’s rating is based on <b>Jabil</b>’s recent financial performance and strategic positioning in the market. <b>Jabil</b>’s fiscal fourth-quarter revenue and non-GAAP earnings per share exceeded ...,https://markets.businessinsider.com/news/stocks/jabil-s-positive-outlook-strong-financials-and-strategic-restructuring-fuel-buy-rating-1033805753,Business Insider,2024-09-30T01:05:00.0000000Z
Why <b>Jabil</b> Inc’s (JBL) Stock Is Up 11.65%,"Avoid the stress of overpaying for a stock or missing an opportunity by using the right tools and insights to evaluate <b>Jabil</b> Inc before investing. In this article, we go over a few key elements for understanding <b>Jabil</b> Inc’s stock price such as ...",https://www.aaii.com/investingideas/article/238374-why-jabil-inc8217s-jbl-stock-is-up-1165,American Association of Individual Investors,2024-09-26T00:01:00.0000000Z
Will <b>Jabil</b> Stock Gain From the Buyout of Mikros Technologies?,"<b>Jabil</b>, Inc. JBL recently closed the acquisition of Mikros Technologies LLC, a leading manufacturer of liquid cooling solutions for an undisclosed amount. With this strategic move, JBL aims to ...",https://www.nasdaq.com/articles/will-jabil-stock-gain-buyout-mikros-technologies,Nasdaq,2024-10-04T15:12:00.0000000Z
<b>Jabil</b> to Expand Operations in India,<b>Jabil</b> Inc. (NYSE: JBL) today announced it has signed a Memorandum of Understanding (MoU) with the Tamil Nadu state government as part of the company’s planned expansion in Tiruchirappalli ...,https://www.businesswireindia.com/jabil-to-expand-operations-in-india-91478.html,Business Wire,2024-09-10T10:32:00.0000000Z
"Apple&#39;s supplier <b>Jabil</b> to invest ₹2,000 cr in Tamil Nadu, aims to create 5,000 jobs","This development will make <b>Jabil</b> the fourth Apple supplier in the state, joining the ranks of Foxconn, Pegatron, and Tata Electronics This new deal was finalised during the U.S. visit of Tamil Nadu&#39;s Chief Minister (CM), M.K. Stalin, on Tuesday <b>Jabil</b> Inc ...",https://www.fortuneindia.com/enterprise/apples-supplier-jabil-to-invest-2000-cr-in-tamil-nadu-aims-to-create-5000-jobs/118369,Fortune India,2024-09-10T00:00:00.0000000Z
<b>Jabil</b> to set up Rs 2K cr electronics unit in TN,"<b>Jabil</b>’s 858,000-square-foot Pune facility employs around 2,500 people. The Tiruchirappalli deal was finalised on Tuesday as part of Chief Minister M K Stalin’s visit to the US.",https://www.rediff.com/business/report/jabil-to-set-up-rs-2k-cr-electronics-unit-in-tn/20240911.htm,rediff.com,2024-09-11T20:42:00.0000000Z
Expert Outlook: <b>Jabil</b> Through The Eyes Of 5 Analysts,"<b>Jabil</b> JBL underwent analysis by 5 analysts in the last quarter, revealing a spectrum of viewpoints from bullish to bearish. The following table provides a quick overview of their recent ratings ...",https://www.benzinga.com/insights/analyst-ratings/24/09/41070408/expert-outlook-jabil-through-the-eyes-of-5-analysts,Benzinga.com,2024-09-27T12:00:00.0000000Z
"<b>Jabil</b> Inc. to invest ₹2,000 crore in electronics manufacturing unit in Tiruchi","<b>Jabil</b> Inc., an American multinational company that supplies electronic components to Apple, Cisco, HP, and Dell, among others, would set up an electronics manufacturing unit in Tiruchi in Tamil ...",https://www.thehindu.com/news/national/tamil-nadu/jabil-inc-to-invest-2000-crore-in-electronics-manufacturing-unit-in-tiruchi-in-tamil-nadu/article68624960.ece,The Hindu,2024-09-10T23:18:00.0000000Z
MoU with the <b>Jabil</b> Inc to change the industrial profile of Tiruchi,The proposed investment by the USA-based <b>Jabil</b> Inc is expected to create a new hub for electronics manufacturing in Tiruchi. As per the Memorandum of Understanding exchanged between the officials ...,https://www.thehindu.com/news/cities/Tiruchirapalli/mou-with-the-jabil-inc-to-change-the-industrial-profile-of-tiruchi/article68630942.ece,The Hindu,2024-09-12T03:03:00.0000000Z
"Apple supplier <b>Jabil</b> to set up Rs 2,000 crore mfg unit in Tiruchirapalli","In a sign of the expanding Apple supplier ecosystem in India, American multinational <b>Jabil</b> Inc will set up an electronics manufacturing facility in Tiruchirappalli with an investment of Rs 2,000 crore. <b>Jabil</b> is one of 14 Apple suppliers in India ...",https://www.business-standard.com/industry/news/apple-supplier-jabil-to-set-up-rs-2-000-crore-mfg-unit-in-tiruchirapalli-124091000078_1.html,Business Standard,2024-09-11T02:01:00.0000000Z
"<b>Jabil</b>&#39;s stock rises on restructuring plan, earnings beat","Manufacturing specialist to take up to $200 million in restructuring charges for a head-count reduction, with more details to come <b>Jabil</b> Inc.&#39;s stock was up 13% Thursday after the industrial ...",https://www.morningstar.com/news/marketwatch/20240926299/jabils-stock-rises-on-restructuring-plan-earnings-beat,Morningstar,2024-09-26T07:21:00.0000000Z
<b>Jabil</b> acquires Claremont&#39;s Mikros Technologies LLC,"Jabil Inc., a global leader in design, manufacturing, and supply chain solutions, announced the successful acquisition of LLC in Claremont, a leader in the engineering and manufacturing of",https://www.unionleader.com/news/business/jabil-acquires-claremonts-mikros-technologies-llc/article_ca1f8aee-8292-11ef-b2da-e361288cce0c.html,New Hampshire Union Leader,2024-10-06T20:52:00.0000000Z
How Is <b>Jabil</b>’s Stock Performance Compared to Other Technology Stocks?,"Based in Saint Petersburg, Florida, <b>Jabil</b> Inc. (JBL) provides manufacturing services and solutions worldwide. Valued at a market cap of $12.9 billion, the company operates in two segments ...",https://www.nasdaq.com/articles/how-jabils-stock-performance-compared-other-technology-stocks,Nasdaq,2024-09-27T14:14:00.0000000Z
<b>Jabil</b> Partners with Infosys to accelerate their SAP S/4 HANA led Digital Transformation Journey,"Ravi Ravishankar, VP &amp; Capabilities CIO - Enterprise IT, <b>Jabil</b> and Cynthia Kendall, Director of <b>Jabil</b> Pathfinder shared how Infosys has partnered with <b>Jabil</b> to transform their highly customized SAP ERP landscape. Infosys leveraged its “S4 Conversion ...",https://www.infosys.com/industries/high-technology/case-studies/led-digital-transformation-journey.html,Infosys,2023-02-18T07:37:00.0000000Z
<b>Jabil</b> Inc. acquires liquid cooling firm Mikros Technologies,Global manufacturing company Jabil Inc. has announced it has acquired liquid cooling firm Mikros Technologies. Mikros Technologies specializes in liquid cooling solutions and thermal management capabilities. Details of the transaction have not been shared.,https://www.datacenterdynamics.com/en/news/jabil-inc-acquires-liquid-cooling-firm-mikros-technologies/,Datacenter Dynamics,2024-10-07T15:01:00.0000000Z
<b>Jabil</b> Names New CEO,"Join this webinar to explore the transformative benefits of retrofitting your existing injection molding machines (IMMs). Engel will guide you through upgrading your equipment to enhance monitoring, control and adaptability — all while integrating ...",https://www.ptonline.com/news/jabil-names-new-ceo,Plastics Technology,2023-05-02T00:00:00.0000000Z
<b>Jabil</b> Inc’s (JBL) Additive Manufacturing: A Hidden Gem or a Risky Bet for Investors?,"We recently published a list of 10 Worst 3D Printing and Additive Manufacturing Stocks To Buy. In this article, we are going to take a look at where Jabil Inc.",https://www.msn.com/en-us/money/savingandinvesting/jabil-inc-s-jbl-additive-manufacturing-a-hidden-gem-or-a-risky-bet-for-investors/ar-AA1rgbqr,Insider Monkey on MSN.com,2024-09-26T14:42:43.0000000Z
<b>Jabil</b> Wins <b>Lean Best Practice Award</b>,<b>Jabil</b> Shanghai was recently named the winner of the Institute of Industrial Engineers (IIE) <b>Lean Best Practice Award</b> in recognition of its efforts to drive innovation and Lean Six Sigma capabilities in optimizing manufacturing processes at its facility.,https://www.reliableplant.com/Read/29791/lean-best-practice,reliableplant,2018-06-21T19:13:00.0000000Z
"US company to invest Rs 2,000 crore in Tamil Nadu manufacturing plant","<b>Jabil</b> is investing ₹2,000 crore in a new manufacturing facility at Manapparai near Trichy, creating about 5,000 jobs. This expansion broadens Apple&#39;s manufacturing ecosystem in Tamil Nadu beyond ...",https://timesofindia.indiatimes.com/city/chennai/us-company-to-invest-rs-2000-crore-in-tamil-nadu-manufacturing-plant/articleshow/113245502.cms,Indiatimes,2024-09-11T15:06:00.0000000Z
