Title,Description,URL,Provider,Date Published
<b>Jabil</b> sheds jobs and costs on demand shifts,"The website you are visiting is protected and accelerated by Incapsula. Your computer may have been infected by malware and therefore flagged by the Incapsula network. Incapsula displays this page for you to verify that an actual human is the source of the traffic to this site, and not malicious software.",https://www.bizjournals.com/tampabay/news/2024/10/04/jabil-to-shed-jobs-cut-costs.html,The Business Journals,2024-10-04T10:56:00.0000000Z
<b>Jabil</b> Inc. (JBL),"As of 2:02 PM EDT. Market Open. ST. PETERSBURG, Fla., October 03, 2024--<b>Jabil</b> Inc. (NYSE: JBL), a global leader in design, manufacturing, and supply chain solutions ...",https://finance.yahoo.com/quote/JBL/press-releases/,Yahoo Finance,2024-10-03T00:00:00.0000000Z
Patriots&#39; Jabrill Peppers facing assault charge in alleged domestic violence incident,Jabrill Peppers pleaded not guilty on Monday to charges that included felony counts of assault and battery with a dangerous weapon and strangulation.,https://www.usatoday.com/story/sports/nfl/patriots/2024/10/07/patriots-jabrill-peppers-arrested/75553465007/,USA Today,2024-10-07T22:12:00.0000000Z
<b>Jabil</b> Inc.,"<b>Jabil</b>, Inc. engages in the provision of manufacturing services and solutions. It operates under the Electronics Manufacturing Services (EMS) and Diversified Manufacturing Services (DMS ...",https://www.cnn.com/markets/stocks/JBL,CNN,2024-04-06T16:36:00.0000000Z
"<b>Jabil</b> Full Year 2024 Earnings: Revenues Beat Expectations, EPS Lags","EPS: US$11.34 (up from US$6.15 in FY 2023). Revenue exceeded analyst estimates by 1.3%. Earnings per share (EPS) missed analyst estimates by 5.4%. Looking ahead, revenue is forecast to stay flat during the next 2 years compared to a 7.5% growth forecast for the Electronic industry in the US.",https://uk.finance.yahoo.com/news/jabil-full-2024-earnings-revenues-104911687.html,Yahoo Finance,2024-09-27T17:45:00.0000000Z
<b>Jabil Inc</b>.,"The Price to Earnings (P/E) ratio, a key valuation measure, is calculated by dividing the stock&#39;s most recent closing price by the sum of the diluted earnings per share from continuing operations ...",https://www.wsj.com/market-data/quotes/JBL,Wall Street Journal,2023-09-28T18:09:00.0000000Z
<b>Jabil</b> Posts Fourth Quarter and Fiscal Year 2024 Results,"Today, Jabil Inc. (NYSE: JBL), reported preliminary, unaudited financial results for its fourth quarter and fiscal year ended August 31, 2024. &quot;It&#39;s evident",https://www.finanznachrichten.de/nachrichten-2024-09/63372314-jabil-posts-fourth-quarter-and-fiscal-year-2024-results-004.htm,Finanznachrichten,2024-06-09T11:30:00.0000000Z
"Patriots captain Jabrill Peppers charged with assault, strangulation after altercation, police say","BRAINTREE, Mass. — A Patriots captain is facing charges of assault, strangulation, and drug possession after an altercation in Braintree on Saturday morning. According to police Jabrill Peppers, 29 was arrested after officers responded to a disturbance ...",https://www.msn.com/en-us/news/other/patriots-safety-charged-with-assault-strangulation-after-altercation-police-say/ar-AA1rPkKu,boston25news on MSN.com,2024-10-07T20:21:00.0000000Z
"Jabrill Peppers, New England Patriots captain, arrested in Braintree, Massachusetts on assault and drug charges","BRAINTREE – Jabrill Peppers, New England Patriots safety and team captain, was arrested Saturday on charges that include strangulation and drug possession after an incident in Braintree, Massachusetts. Braintree police announced Peppers&#39; arrest on Monday.",https://www.msn.com/en-us/news/other/jabrill-peppers-new-england-patriots-safety-arrested-in-braintree-massachusetts-on-assault-and-drug-charges/ar-AA1rPyJe,CBS News on MSN.com,2024-10-07T19:16:00.0000000Z
<b>Jabil</b> Acquires Mikros Technologies to Support Demand for Liquid Cooling in AI Data Centers,"Jabil Inc. (NYSE: JBL), a global leader in design, manufacturing, and supply chain solutions, today announced the successful acquisition of Mikros Technologies LLC, a leader in the engineering and manufacturing of liquid cooling solutions for thermal management, completed October 1.",https://stockhouse.com/news/press-releases/2024/10/03/jabil-acquires-mikros-technologies-to-support-demand-for-liquid-cooling-in-ai,Stockhouse,2024-10-03T11:00:00.0000000Z
"Apple Supplier <b>Jabil</b> Announces Restructuring, Beats Fourth-Quarter Estimates","(Reuters) - Electronic components maker <b>Jabil</b> on Thursday beat fourth-quarter estimates and announced restructuring plans, including headcount reductions, sending its shares up as much as 10% in ...",https://www.usnews.com/news/technology/articles/2024-09-26/apple-supplier-jabil-announces-restructuring-beats-fourth-quarter-estimates,U.S. News &amp; World Report,2024-09-26T00:01:00.0000000Z
"<b>Jabil</b>, Inc.: <b>Jabil</b> Expands Silicon Photonics Capabilities to Enable Next-Generation AI and Data Center Technologies","Broadened offerings at Ottawa, Canada, site to support customers&#39; silicon photonics new product introductions Jabil Inc. (NYSE: JBL), a global leader in design, manufacturing, and supply chain solutio",https://www.finanznachrichten.de/nachrichten-2024-09/63331052-jabil-inc-jabil-expands-silicon-photonics-capabilities-to-enable-next-generation-ai-and-data-center-technologies-004.htm,Finanznachrichten,2024-09-23T12:19:00.0000000Z
Patriots Jabrill Peppers charged with choking girlfriend. Read the police report details,"New England Patriots safety Jabrill Peppers girlfriend said he choked her, smashed her head against a wall and pushed her down the stairs on Saturday.",https://www.msn.com/en-us/news/crime/patriots-jabrill-peppers-charged-with-choking-girlfriend-read-the-police-report-details/ar-AA1rPY6r,Patriot Ledger on MSN.com,2024-10-07T17:05:07.0000000Z
"Aerial footage shows Asheville, North Carolina before and after Helene&#39;s devastation","Aerial footage is capturing the extent of Hurricane Helene&#39;s cataclysmic impact on Asheville, North Carolina. Watch the aerial footage.",https://www.usatoday.com/story/news/nation/2024/10/03/asheville-nc-before-after-helene/75502115007/,USA Today,2024-10-03T23:34:00.0000000Z
"Asheville flooding map: See where rainfall hit, leading to deadly floods in Western North Carolina",This map shows rainfall from Helene and in the days preceding the storm that combined to create disastrous flooding.,https://www.cincinnati.com/story/news/local/2024/09/30/asheville-nc-flooding-map-shows-heavy-rainfall-areas-deadly-flooding/75451276007/,The Cincinnati Enquirer,2024-10-01T16:55:00.0000000Z
AHF: J&amp;J Retreats From Its Scheme to Gut 340B Drug Pricing Program,J&amp;J’s retreat shows its &quot;340B is not sustainable&quot; argument is nonsense and should be disregarded whenever it is raised. Drug companies will not quit the lucrative taxpayer-funded Medicaid and Medicare drug markets.,https://www.businesswire.com/news/home/20240930333614/en/ahf-jj-retreats-from-its-scheme-to-gut-340b-drug-pricing-program/,Business Wire,2024-10-01T01:37:00.0000000Z
<b>Jabil</b> Acquires Liquid Cooling Company Mikros Technologies,"Jabil Inc. (NYSE: JBL) today announced the acquisition of Mikros Technologies LLC, an engineering and manufacturing company focused on of liquid cooling solutions for thermal management, completed October 1.",https://insidehpc.com/2024/10/jabil-acquires-liquid-cooling-company-mikros-technologies/,insideHPC,2024-10-03T20:07:00.0000000Z
Q4 2024 <b>Jabil</b> Inc Earnings Call,Samik Chatterjee; Analyst; JPMorgan Chasing Company,https://finance.yahoo.com/news/q4-2024-jabil-inc-earnings-055608542.html,YAHOO!Finance,2024-09-27T05:59:00.0000000Z
"Patriots&#39; Jabrill Peppers charged with strangulation, drug possession","Patriots safety Jabrill Peppers was arrested Saturday and was charged Monday with assault, strangulation and drug possession. He pleaded not guilty.",https://www.espn.com/nfl/story/_/id/41660780/patriots-jabrill-peppers-arrested-assault-drug-charges,ESPN,2024-10-07T13:15:00.0000000Z
"Patriots&#39; Jabrill Peppers Arrested, Facing Strangulation and Drug Possession Charges","New England Patriots safety Jabrill Peppers was arrested over the weekend and is facing a combination of assault, strangulation, and drug charges, reports said on Monday morning.",https://www.si.com/nfl/patriots-jabrill-peppers-arrested-facing-strangulation-and-drug-possession-charges,Sports Illustrated,2024-10-07T19:05:00.0000000Z
<b>Jabil</b> Inc. Beats Expectations with $7 B in Q4 Revenue and $2.30 Core EPS,"CEO Mike Dastoor highlighted that despite facing challenges in multiple end-markets, Jabil managed to deliver core margins of 5.5% and $8.49 of core diluted EPS for the fiscal year 2024. The firm also generated over $1 billion in adjusted free cash flow and returned $2.5 billion to shareholders through buybacks.",https://tokenist.com/jabil-inc-beats-expectations-with-7-b-in-q4-revenue-and-2-30-core-eps/,The Tokenist,2024-09-26T11:42:00.0000000Z
Apple supplier <b>Jabil</b> to set up South India plant with $238 million investment,NEW DELHI (Reuters) - Electronic components maker <b>Jabil</b> will set up a manufacturing plant in India&#39;s southern state of Tamil Nadu with an investment of about 20 billion rupees ($238.2 million ...,https://www.thestar.com.my/tech/tech-news/2024/09/10/apple-supplier-jabil-to-set-up-south-india-plant-with-238-million-investment,The Star,2024-09-10T13:30:00.0000000Z
"<b>Jabil</b> to create 5,000 jobs at new global manufacturing site",The St. Petersburg company is making inroads in one of the industry&#39;s fastest-growing electronics manufacturing hubs. <b>Jabil</b> is expanding its footprint in India with a new plant in the Southern ...,https://www.bizjournals.com/tampabay/news/2024/09/10/jabil-manufacturing-facility-india.html,The Business Journals,2024-09-10T00:00:00.0000000Z
"In St. Petersburg and beyond, Hurricane Helene flooding is unlike any other storm","Edwin Sprague trudged through hip-deep water in canvas shoes and khaki shorts. The 56-year-old left his truck on higher ground, deciding to walk to the home where his ex-wife and daughter, Kala and Meredith Sprague, were waiting, about a block away in the ...",https://www.tampabay.com/hurricane/2024/09/27/hurricane-helene-st-petersburg-flooding-shore-acres/,Tampa Bay Times,2024-09-27T00:00:00.0000000Z
<b>Jabil</b> Inc. (JBL) Q4 2024 Earnings Call Transcript,"Good morning, and welcome to <b>Jabil</b>&#39;s Fourth Quarter and Fiscal Year 2024 Earnings Call. It&#39;s also our 7th Annual Virtual Investor Briefing. I&#39;m Adam Berry, Senior Vice President of Investor ...",https://seekingalpha.com/article/4723537-jabil-inc-jbl-q4-2024-earnings-call-transcript,Seeking Alpha,2024-09-26T18:38:00.0000000Z
<b>Jabil</b> Q4 Earnings Top Estimates Despite Weakness in Multiple Verticals,"<b>Jabil</b>, Inc. JBL reported healthy fourth-quarter fiscal 2024 results, with both the bottom and top lines surpassing the Zacks Consensus Estimate. However, weakness in multiple end markets, including networking, storage, digital print, retail, 5G wireless ...",https://sg.finance.yahoo.com/news/jabil-q4-earnings-top-estimates-160100943.html,Yahoo Finance,2024-09-26T09:01:00.0000000Z
Asheville flooding: Hurricane Helene drone footage shows swallowed city streets,"Hurricane Helene’s remnants have dropped between a foot and two feet of rainfall in western North Carolina, devastating Asheville and other mountainous communities.",https://www.fox6now.com/news/asheville-nc-flooding-drone-helene-hurricane,fox6now,2024-09-30T11:47:00.0000000Z
Stock market today: Wall Street ticks to another record as stocks worldwide rally,Shares rolled higher in Asia on Thursday after U.S. stocks edged back from their records. Japan’s Nikkei 225 index gained more than 2% and U.S. futures and oil prices also advanced.,https://www.msn.com/en-us/money/markets/stock-market-today-asian-markets-surge-higher-after-wall-street-takes-a-breather/ar-AA1rdUp2,The Associated Press on MSN.com,2024-09-26T20:13:00.0000000Z
<b>Jabil</b> Posts Fourth Quarter and Fiscal Year 2024 Results,We sell different types of products and services to both investment professionals and individual investors. These products and services are usually sold through license agreements or subscriptions ...,https://www.morningstar.com/news/business-wire/20240926547610/jabil-posts-fourth-quarter-and-fiscal-year-2024-results,Morningstar,2024-08-31T00:00:00.0000000Z
Why Did Argus Give <b>Jabil</b> Inc (JBL) Stock Hold Rating?,"Jabil Inc (JBL) stock saw a modest uptick, ending the day at $113.43 which represents a slight increase of $0.57 or 0.51% from the prior close of $112.86. The stock opened at $113.41 and touched a low of $113.",https://www.bovnews.com/2024/09/26/why-did-argus-give-jabil-inc-jbl-stock-hold-rating/,bovnews,2024-09-26T19:07:00.0000000Z
St. Petersburg&#39;s <b>Jabil</b> buys New Hampshire manufacturer,"St. Petersburg technology giant Jabil has bought Mikros Technologies, a New Hampshire company that makes “liquid cooling solutions for thermal management.” Terms of the deal, which closed Oct. 1, were not disclosed.",https://www.businessobserverfl.com/news/2024/oct/03/jabil-buys-manufacturer/,Business Observer,2024-10-03T14:55:00.0000000Z
"Clearwater Beach businesses cleaning up from sand and storm surge, visitors urged to stay away",Clearwater Beach will reopen to visitors Tuesday but Mayor Bruce Rector is asking people to give the community time.,https://www.wfla.com/news/pinellas-county/clearwater-beach-businesses-cleaning-up-from-sand-and-storm-surge-visitors-urged-to-stay-away/,WFLA News Channel 8,2024-09-30T14:31:00.0000000Z
<b>Jabil</b> delivers better-than-expected fiscal Q4 results; shares jump,"Jabil Circuit Inc (NYSE:JBL) saw its shares popped more than 9% in premarket trading Thursday after the company reported better-than-anticipated results for the fiscal Q4 2024. Specifically, Jabil posted Q4 earnings per",https://www.msn.com/en-in/money/markets/jabil-delivers-better-than-expected-fiscal-q4-results-shares-jump/ar-AA1rfxZ3,in.investing.com on MSN.com,2024-09-26T12:46:07.0000000Z
"After iPhones, Apple now plans Made-in-India AirPods: Report","The move comes after the US-based company shifted the production of iPhones worth several billion dollars to India in recent years, the newspaper said",https://www.moneycontrol.com/technology/after-iphones-apple-now-plans-made-in-india-airpods-report-article-12834453.html,moneycontrol.com,2024-10-03T05:41:00.0000000Z
<b>Jabil</b> Q4 Profit Tops Estimates; Announces $1 Bln Share Repurchase Authorization,"(RTTNews) - <b>Jabil</b> (JBL) reported preliminary fourth quarter net income attributable to company of $138 million compared to $155 million, last year. Earnings per share was $1.18 compared to $1.15.",https://markets.businessinsider.com/news/stocks/jabil-q4-profit-tops-estimates-announces-1-bln-share-repurchase-authorization-1033800466,Business Insider,2024-09-26T08:32:00.0000000Z
"Apple supplier <b>Jabil</b> plans Rs 2,000-cr electronics manufacturing plant in Trichy","Electronic component supply giant <b>Jabil</b> plans to invest Rs 2,000 crore to set up a manufacturing facility in Trichy, creating around 5,000 jobs in Tamil Nadu, according to a statement from the ...",https://www.moneycontrol.com/news/business/companies/apple-supplier-jabil-plans-rs-2000-cr-electronics-manufacturing-plant-in-trichy-12818089.html,moneycontrol.com,2024-09-10T13:30:00.0000000Z
"Apple Partner <b>Jabil</b> To Set Up Rs 2,000 Crore Manufacturing Plant In Tamil Nadu","Electronics manufacturer <b>Jabil</b> is set to establish a new plant in Tamil Nadu with an investment of approximately Rs 20 billion ($238.2 million), the state’s industries minister announced on Tuesday. US-based <b>Jabil</b>, a supplier for Apple, is set to ...",https://www.news18.com/business/apple-supplier-jabil-tamil-nadu-plant-9045462.html,CNN-News18,2024-09-10T11:53:00.0000000Z
<b>Jabil</b> Inc (JBL),"<b>Jabil</b> Inc is a provider of electronic manufacturing services and solutions. It provides electronic design, production and product management services to companies in the aerospace and defense, automotive.",https://www.fidelity.co.uk/factsheet-data/factsheet/US4663131039USD-jabil-inc/www.fidelityinternational.com/whistleblowing/,Fidelity International,2024-10-05T14:10:00.0000000Z
Is <b>Jabil</b> Stock (JBL) a Good Investment?,"As of September 10, 2024, <b>Jabil</b> Inc had a $11.6 billion market capitalization, putting it in the 87th percentile of companies in the Electronic Equipment &amp; Parts industry. Currently, <b>Jabil</b> Inc’s price-earnings ratio is 9.3. <b>Jabil</b> Inc’s trailing 12 ...",https://www.aaii.com/investingideas/article/15284-is-jabil-stock-jbl-a-good-investment,American Association of Individual Investors,2024-09-11T00:00:00.0000000Z
Will <b>Jabil</b> Stock Gain From the Buyout of Mikros Technologies?,"Jabil, Inc. JBL recently closed the acquisition of Mikros Technologies LLC, a leading manufacturer of liquid cooling solutions for an undisclosed amount. With this strategic move, JBL aims to expand its portfolio and match the growing demand for effective thermal management systems across a wide range of applications.",https://www.msn.com/en-us/money/smallbusiness/will-jabil-stock-gain-from-the-buyout-of-mikros-technologies/ar-AA1rHRUF,Zacks.com on MSN.com,2024-10-04T15:12:00.0000000Z
Electronic manufacturer <b>Jabil</b> to invest Rs 2000 crore in Tamil Nadu,"NEW DELHI: US-based electronics manufacturing company <b>Jabil</b> has announced plans to invest Rs. 2000 crore to set up a manufacturing facility in Tiruchirapalli, Tamil Nadu. The company, a key ...",https://www.newindianexpress.com/business/2024/Sep/10/electronic-manufacturer-jabil-to-invest-rs-2000-crore-in-tamil-nadu,The New Indian Express,2024-09-10T08:58:00.0000000Z
"Apple supplier <b>Jabil</b> plans ₹2,000 crore manufacturing plant in Trichy: ‘New electronics cluster in Tamil Nadu’","Electronic component supply giant <b>Jabil</b>- supplier to Apple, Cisco and HP- plans to invest ₹2,000 crore to set up a manufacturing facility in Trichy which is set to create around 5,000 jobs in ...",https://www.hindustantimes.com/business/apple-supplier-jabil-plans-rs-2-000-crore-manufacturing-plant-in-trichy-new-electronics-cluster-in-tamil-nadu-101725938878280.html,Hindustan Times,2024-09-10T14:35:00.0000000Z
"Top Stock Movers Now: Micron, Super Micro Computer, <b>Jabil</b>, and More","Major U.S. indexes gained at midday Thursday as chip stocks surged, led by Micron Technology after the memory chip maker reported strong sales driven by AI demand.",https://www.investopedia.com/top-stock-movers-now-micron-super-micro-computer-jabil-and-more-8718823,Investopedia,2024-09-26T17:04:00.0000000Z
"<b>Jabil</b> Inc to invest Rs 2,000 crore in Trichy","🔹A significant investment of ₹2000 crores at Tiruchirapalli by <b>Jabil</b>, a global leader in EMS. This will create 5000 jobs and create a new cluster for electronics manufacturing.",https://www.deccanherald.com/india/tamil-nadu/jabil-inc-to-invest-rs-2000-crore-in-trichy-3185833,Deccan Herald,2024-09-11T12:37:00.0000000Z
"<b>Jabil</b>&#39;s Q4: Earnings Beat, $1B Buyback, FY25 Guidance And More","<b>Jabil</b> reports Q4 revenue of $6.96B, beating estimates but down 17.7% YoY <b>Jabil</b> announces $1B stock buyback, forecasts $27B revenue for fiscal 2025 The print manufacturing company’s adjusted EPS ...",https://www.benzinga.com/news/earnings/24/09/41045374/jabils-q4-earnings-beat-1b-buyback-fy25-guidance-and-more,Benzinga.com,2024-09-26T08:32:00.0000000Z
"<b>Jabil</b>’s stock rises on restructuring plan, earnings beat","Jabil Inc. to take up to $200 million in restructuring charges for a head-count reduction, with more details to come.",https://www.marketwatch.com/story/jabil-stock-rises-on-restructuring-plan-earnings-beat-23a29de0,MarketWatch,2024-09-26T14:21:00.0000000Z
Apple Supplier <b>Jabil</b> Begins Making AirPods Components In India,Apple is shifting its manufacturing base to India owing to the US trade restrictions and COVID-related disruptions in China The development comes almost two weeks after 14 Chinese suppliers of ...,https://inc42.com/buzz/apple-supplier-jabil-begins-making-airpods-components-in-india/,inc42,2023-01-29T23:59:00.0000000Z
"Apple supplier <b>Jabil</b>&#39;s massive ₹2,000 crore investment in Trichy to create 5,000 jobs, says Tamil Nadu CM, MK Stalin","American electronics manufacturer <b>Jabil</b> has announced plans to invest ₹2,000 crore in a new facility in Trichy, Tamil Nadu. The project is expected to create approximately 5,000 jobs ...",https://www.livemint.com/companies/news/apple-supplier-jabils-massive-rs-2-000-crore-investment-in-trichy-to-create-5-000-jobs-says-tamil-nadu-cm-mk-stalin/amp-11725938989716.html,Mint,2024-09-10T14:59:00.0000000Z
These Stocks Are Moving the Most Today,"The Dow, S&amp;P 500 and Nasdaq rose as the stock market reacted to China&#39;s stimulus, Micron&#39;s earnings, and solid economic data.",https://www.barrons.com/livecoverage/stock-market-today-092624/card/these-stocks-are-moving-the-most-today-ERcUfbnS5LGcgGr6adW0?mod=livecoverage_timeline,Barron&#39;s,2024-07-11T09:29:00.0000000Z
Apple supplier <b>Jabil</b> to set up South India plant with $238 mln investment,"NEW DELHI, Sept 10 (Reuters) - Electronic components maker <b>Jabil</b> (JBL.N), opens new tab will set up a manufacturing plant in India&#39;s southern state of Tamil Nadu with an investment of about 20 ...",https://www.reuters.com/technology/apple-supplier-jabil-set-up-south-india-plant-with-238-mln-investment-2024-09-10/,Reuters,2024-09-10T00:00:00.0000000Z
"Apple supplier <b>Jabil</b> to set up a plant at Trichy with Rs 2,000 crore capex","Apple supplier <b>Jabil</b> is set to open an electronics manufacturing plant in Trichy, Tamil Nadu, investing Rs 2,000 crore and potentially creating 5,000 jobs. Rockwell Automation will expand its ...",https://timesofindia.indiatimes.com/business/india-business/apple-supplier-jabil-to-set-up-a-plant-at-trichy-with-rs-2000-crore-capex/articleshow/113214621.cms,Indiatimes,2024-09-10T16:31:00.0000000Z
"TN’s Electronic Manufacturing Push: Apple Supplier <b>Jabil</b> Mulls INR 2,000 Cr Plant In Trichy","This will create 5,000 jobs and create a new cluster for electronics manufacturing, said the Tamil Nadu CM MK Stalin With <b>Jabil</b>&#39;s entry into the state, Tamil Nadu now hosts several major Apple ...",https://inc42.com/buzz/tns-electronic-manufacturing-push-apple-supplier-jabil-mulls-inr-2000-cr-plant-in-trichy/,inc42,2024-09-10T00:00:00.0000000Z
<b>Jabil</b> CEO Michael Dastoor Appointed to Board of Directors,"ST. PETERSBURG, Fla.--(BUSINESS WIRE)--<b>Jabil</b> Inc. (NYSE: JBL) announced today that CEO Michael Dastoor has been appointed to the company’s Board of Directors. This appointment follows Dastoor&#39;s ...",https://www.businesswire.com/news/home/20240903482383/en/Jabil-CEO-Michael-Dastoor-Appointed-to-Board-of-Directors,Business Wire,2024-09-03T08:00:00.0000000Z
Key Apple supplier <b>Jabil</b> to set up electronics manufacturing unit in Trichy,"The new unit by <b>Jabil</b> marks the entry of yet another Apple Inc. supplier to Tamil Nadu, which already boasts of massive facilities owned by Foxconn, Pegatron, Tata Electronics, and Salcomp.",https://www.deccanherald.com/india/tamil-nadu/key-apple-supplier-jabil-to-set-up-electronics-manufacturing-unit-in-trichy-3183904,Deccan Herald,2024-09-10T09:48:00.0000000Z
"<b>Jabil</b> stock boosted by strong earnings and long-term growth potential, says BofA","On Friday, BofA Securities has increased its price target for <b>Jabil</b> (NYSE:JBL), a manufacturing services company, to $150 from the previous $135, while maintaining a Buy rating on the stock.",https://www.investing.com/news/company-news/jabil-stock-boosted-by-strong-earnings-and-longterm-growth-potential-says-bofa-93CH-3635698,Investing,2024-09-27T10:27:00.0000000Z
"<b>Jabil</b> to set up Rs 2,000 crore plant in Tamil Nadu, boosting Apple’s supply chain","Earlier this year, <b>Jabil</b> began producing AirPod components for Apple in India and currently operates an 858,000 sq ft facility in Pune. (Image/Reuters) <b>Jabil</b>, a global electronics contract ...",https://www.financialexpress.com/business/industry-jabil-to-set-up-rs-2000-crore-plant-in-tamil-nadu-boosting-apples-supply-chain-3607373/,The Financial Express,2024-09-11T06:00:00.0000000Z
"Apple supplier <b>Jabil</b> to set up manufacturing facility in Trichy for Rs 2,000 crore",A Memorandum of Understanding (MoU) was exchanged between <b>Jabil</b> officials and the Tamil Nadu state delegation on Tuesday in the presence of Tamil Nadu CM MK Stalin who has been in the US on a 17-day trip to garner fresh investments. Apple supplier <b>Jabil</b> ...,https://economictimes.indiatimes.com/tech/technology/apple-supplier-jabil-to-set-up-manufacturing-facility-in-trichy-for-rs-2000-crore/articleshow/113209207.cms,Indiatimes,2024-09-10T13:43:00.0000000Z
"Apple supplier <b>Jabil</b> announces restructuring, beats fourth-quarter estimates","Jabil: The St. Petersburg, Florida-based company, which counts Apple as its customer, makes electronic components such as circuit board assemblies and systems that cater to the automotive, cloud and commercial drones,",https://telecom.economictimes.indiatimes.com/news/devices/apple-supplier-jabil-announces-restructuring-beats-fourth-quarter-estimates/113708845,telecom.economictimes.indiatimes,2024-09-26T15:50:00.0000000Z
