Title,Description,URL,Provider,Date Published
shoeper/<b>kyocera</b>-printer-install,On recent OS Python 2 support is usually dropped. The <b>Kyocera</b> driver for printers like the FS-1370DN are using a Filter using python2 which doesn&#39;t work out of the box. This simple script installs the driver and modifies the installation to make it work.,https://github.com/shoeper/kyocera-printer-install,GitHub,2021-07-27T10:16:00.0000000Z
Newly discovered star with the highest lithium content in the Universe,"Newly discovered star with the highest lithium content in the Universe. Astronomers have long known that in the realm of Sun-like stars, the older star, the less lithium it contai",https://www.unige.ch/sciences/astro/en/news/decouverte-etoile-lithium/,unige.ch,2024-09-27T14:57:00.0000000Z
<b>Kyocera 7135</b>,"photos courtesy of <b>Kyocera</b> Wireless Corp. This tri-mode, 3G CDMA smartphone sports an innovative folder-style form factor that places the handwriting input pad and display on opposite halves of ...",https://www.phonescoop.com/phones/phone.php?id=173,Phone Scoop,2024-10-07T00:00:00.0000000Z
<b>Kyocera SE47 / SE44 / V5 (Slider</b>),"This dual-band CDMA phone is <b>Kyocera</b>&#39;s first model with a sliding form factor. Additional features include a 65,000-color display, BREW, 1xRTT high-speed data, speaker phone, and voice dialing.",https://www.phonescoop.com/phones/phone.php?p=322,Phone Scoop,2024-10-08T00:00:00.0000000Z
What was the <b>first cell phone ever</b> to carry a built-in camera?,"Choose your answer and the correct choice will be revealed. Although it was only sold in Japan for the PHS network, <b>Kyocera</b>&#39;s VP-210 VisualPhone began selling for 40,000 yen or about $325 in May ...",https://www.techspot.com/trivia/71-what-first-cell-phone-ever-carry-built-camera/,TechSpot,2024-01-23T05:20:00.0000000Z
<b>BLACKPINK: Arena Tour 2018 &#39;Special Final in Kyocera</b> Dome Osaka&#39;,"BLACKPINK in <b>Kyocera</b> Dome! The K-pop girl group had eight shows in three cities for their 2018 Japan arena tour, and became the first overseas girl group to hold a concert at Osaka&#39;s <b>Kyocera</b> Dome ...",https://www.moviefone.com/movie/blackpink-arena-tour-2018-special-final-in-kyocera-dome-osaka/Ry3PCChTzfnJW7lgQNLk66/main/,Moviefone,2020-11-12T00:09:00.0000000Z
<b>New Plastic Imitation Opal from Kyocera</b>,"Recently, the Carlsbad laboratory examined an interesting new gem material manufactured by the Japanese company <b>Kyocera</b> that displayed a play-of-color phenomenon. In the trade, this material may be sold as an “opal-like product,” because of the play-of ...",https://www.gia.edu/gems-gemology/spring-2018-labnotes-new-plastic-imitation-opal-from-kyocera,Gemological Institute of America,2018-05-26T00:27:00.0000000Z
