Title,Description,URL,Provider,Date Published
Analysts Bullish on <b>NXP Semiconductors</b> N.V. (NXPI) with 24% Upside,"We recently published a list of the 13 Most Undervalued Blue Chip Stocks To Buy According To Analysts. In this article, we are going to take a look at where NXP Semiconductors N.V.",https://www.insidermonkey.com/blog/analysts-bullish-on-nxp-semiconductors-n-v-nxpi-with-24-upside-1359166/,Insider Monkey,2024-09-25T04:10:00.0000000Z
<b>NXP Semiconductors</b> N.V. (NASDAQ:NXPI): A Chip Stock Powering The AI Boom,"In this article, we are going to take a look at where <b>NXP Semiconductors</b> N.V. (NASDAQ:NXPI) stands against the other AI stocks. AI has played a pivotal role in driving growth within the ...",https://www.insidermonkey.com/blog/nxp-semiconductors-n-v-nasdaqnxpi-a-chip-stock-powering-the-ai-boom-1354226/,Insider Monkey,2024-09-17T13:25:00.0000000Z
<b>NXP Semiconductors</b> to invest more than $1 billion to boost its R&amp;D in India,"<b>NXP Semiconductors</b> is set to invest more than $1 billion in India to bolster its R&amp;D efforts in the region. Speaking at the inaugural Semicon India conference, CEO Kurt Sievers said that the company was “committed to doubling its R&amp;D efforts here in the ...",https://www.datacenterdynamics.com/en/news/nxp-semiconductors-to-invest-more-than-1-billion-to-boost-its-rd-in-india/,Datacenter Dynamics,2024-09-11T23:59:00.0000000Z
"Quectel Expands IoT Wi-Fi and Bluetooth Module Portfolio, Boosting Speed and Cost Efficiency for Faster Time-to-market","Quectel Wireless Solutions, a global IoT solutions provider, today announced the introduction of three additional short-range modules to its portfolio. The modules are the FC30R, a cost-effective, industrial-grade Wi-Fi module;",https://www.afp.com/en/news/1312/quectel-expands-iot-wi-fi-and-bluetooth-module-portfolio-boosting-speed-and-cost-efficiency-faster-time-market-202410074060271,AFP,2024-10-07T15:42:00.0000000Z
NXP and VIS joint venture to build 300mm wafer fab in Singapore,<b>NXP Semiconductors</b> and Vanguard International Semiconductor Corporation (VIS) have been granted approval to establish the VisionPower Semiconductor Manufacturing Company (VSMC) joint venture. The new company will now move ahead with the planned ...,https://www.datacenterdynamics.com/en/news/nxp-and-vis-joint-venture-to-build-300mm-wafer-fab-in-singapore/,Datacenter Dynamics,2024-09-06T00:01:00.0000000Z
"NXP to double its India workforce to 6,000+ in five years","<b>NXP Semiconductors</b> plans to double its workforce in India to more than 6,000 over the next five years, the Dutch chip manufacturing and design company&#39;s chief executive, Kurt Sievers, told ET. The company will also invest $1 billion in the next five years ...",https://economictimes.indiatimes.com/tech/technology/nxp-to-double-its-india-workforce-to-6000-in-five-years/articleshow/113269471.cms,Indiatimes,2024-09-12T11:30:00.0000000Z
