Title,Description,URL,Provider,Date Published
<b>Sunny Optical Technology (Group) Co Ltd</b> 02382,We sell different types of products and services to both investment professionals and individual investors. These products and services are usually sold through license agreements or subscriptions ...,https://www.morningstar.com/stocks/xhkg/02382/quote,Morningstar,2024-10-04T00:00:00.0000000Z
<b>Sunny Optical Technology (Group) Co Ltd</b>,We sell different types of products and services to both investment professionals and individual investors. These products and services are usually sold through license agreements or subscriptions ...,https://www.morningstar.com/stocks/xhkg/02382/valuation,Morningstar,2024-10-07T00:00:00.0000000Z
<b>Sunny Optical Technology Group Co. Ltd</b>.,Stocks: Real-time U.S. stock quotes reflect trades reported through Nasdaq only; comprehensive quotes and volume reflect trading in all markets and are delayed at least 15 minutes. International ...,https://www.wsj.com/market-data/quotes/HK/XHKG/2382/research-ratings,Wall Street Journal,2024-10-07T00:00:00.0000000Z
<b>Sunny Optical Technology (Group) Company Limited</b> (2382.HK),"As global markets face economic uncertainties and mixed performances, the Hong Kong market has not been immune to these challenges. The Hang Seng Index recently experienced a decline, reflecting ...",https://finance.yahoo.com/quote/2382.HK/news/,Yahoo Finance,2024-09-17T16:08:00.0000000Z
<b>Sunny Optical Technology Group Co. Ltd</b>.,"The Price to Earnings (P/E) ratio, a key valuation measure, is calculated by dividing the stock&#39;s most recent closing price by the sum of the diluted earnings per share from continuing operations ...",https://www.wsj.com/market-data/quotes/HK/XHKG/2382,Wall Street Journal,2024-10-04T00:00:00.0000000Z
Hong Kong stocks climb to 3-week high as China pledges to boost imports to strengthen ties with trade partners,"China to loosen policies to buy more products from trade partners, citing colossal purchasing power at home, Premier Li Qiang says Hang Seng Index reaches the highest close since October 12, building on a two-week advance Hong Kong stocks rose to a three-week high after Chinese Premier Li Qiang pledged to loosen policies and boost imports as Beijing looks to strengthen ties with major trading partners.",https://www.msn.com/en-xl/money/other/hong-kong-stocks-climb-to-3-week-high-as-china-pledges-to-boost-imports-to-strengthen-ties-with-trade-partners/ar-AA1jrc0t,South China Morning Post on MSN.com,2023-11-06T02:29:10.0000000Z
<b>Sunny Optical</b> Technology Group Co Ltd (2382),"Get an in-depth profile of <b>Sunny Optical</b> Technology Group Co Ltd, including a general overview of the company&#39;s business and key management, as well as employee data and location and contact information.",https://in.investing.com/equities/sunny-optical-hk-company-profile,Investing,2017-09-27T12:56:00.0000000Z
3 SEHK Stocks That May Be Undervalued In September 2024,"The Hong Kong stock market has shown resilience amid global economic fluctuations, with the Hang Seng Index recently gaining 5.12%. As investors navigate these dynamic conditions, identifying undervalued stocks can present compelling opportunities for those looking to capitalize on potential market inefficiencies.",https://uk.finance.yahoo.com/news/3-sehk-stocks-may-undervalued-230509955.html,Yahoo Finance,2024-09-23T19:06:00.0000000Z
<b>Sunny Optical</b> Technology Group Co. Ltd. ADR,Stocks: Real-time U.S. stock quotes reflect trades reported through Nasdaq only; comprehensive quotes and volume reflect trading in all markets and are delayed at least 15 minutes. International ...,https://www.barrons.com/market-data/stocks/sotgy,Barron&#39;s,2021-08-08T21:22:00.0000000Z
High Growth Tech Stocks to Watch in Hong Kong This October 2024,"Hong Kong&#39;s tech sector has been riding a wave of optimism, buoyed by China&#39;s recent stimulus measures aimed at revitalizing the economy. As global markets respond positively to these developments, the Hang Seng Index has seen significant gains,",https://finance.yahoo.com/news/high-growth-tech-stocks-watch-230520924.html,YAHOO!Finance,2024-10-01T23:25:00.0000000Z
I’m worried Apple will skip its October event – here’s what that means for the M4 MacBook Pro,"Could Apple skip its October event and announce the M4 MacBook Pro using a press release? It’s possible, but it might mean bad things for the M4 chip.",https://www.msn.com/en-us/news/other/i-m-worried-apple-will-skip-its-october-event-here-s-what-that-means-for-the-m4-macbook-pro/ar-AA1rPTu9,Digital Trends on MSN.com,2024-10-07T14:41:46.0000000Z
Analysts Offer Insights on Technology Companies: Analog Devices (ADI) and Lam Research (LRCX),There’s a lot to be optimistic about in the Technology sector as 2 analysts just weighed in on Analog Devices (ADI – Research Report) and,https://markets.businessinsider.com/news/stocks/analysts-offer-insights-on-technology-companies-analog-devices-adi-and-lam-research-lrcx-1033827517,Business Insider,2024-10-08T12:06:00.0000000Z
"Are investors walking into a monster bull trap? Watch for these signals, says portfolio manager.","China sales fell short and overall guidance was disappointing, but <b>Sunny Optical</b> and other Chinese smartphone suppliers rallied. Nio stock is up after a report the Chinese EV maker will cut 10% of ...",https://www.msn.com/en-us/money/topstocks/are-investors-walking-into-a-monster-bull-trap-watch-for-these-signals-says-portfolio-manager/ar-AA1jkg0u,MSN,2023-11-03T13:13:00.0000000Z
The next Apple Vision Pro is tipped to debut the M5 chip next year,"A new Vision Pro model will enter mass production during the second half of 2025, according to reliable Apple analyst Ming-Chi Kuo, and it will be powered by the yet-to-be-announced M5 chip. The ...",https://www.digitaltrends.com/computing/vision-pro-2-will-have-m5-chip-and-apple-intelligence/,Digital Trends,2024-09-27T00:00:00.0000000Z
FORA:CA VerticalScope Holdings Inc.,"VerticalScope Holdings Inc., a technology company, operates a cloud-based digital community platform for online enthusiast communities in the United States, Canada, the United Kingdom, and ...",https://seekingalpha.com/symbol/FORA:CA,Seeking Alpha,2024-10-02T16:00:00.0000000Z
CATL Charges Up While Investors Should Ask If It’s Not Always <b>Sunny Optical</b> In Apple,"<b>Sunny Optical</b> fell -11.66% as profit dropped about 50% to 55% as the cell phone lens maker, which could be a canary in the coal mine for those who own the Fruit. Hong Kong EV stocks were off ...",https://www.forbes.com/sites/brendanahern/2024/01/31/catl-charges-up-while-investors-should-ask-if-its-not-always-sunny-optical-in-apple/,Forbes,2024-01-31T15:50:00.0000000Z
"Apple Explores Indian Suppliers Across Auto, Aerospace And Consumer Electronics For Parts","Apple is engaging with suppliers in automotive, aerospace and consumer electronics to explore potential supplier arrangements across multiple product categories Apple is in preliminary talks with ...",https://inc42.com/buzz/apple-explores-indian-suppliers-across-auto-aerospace-and-consumer-electronics-for-parts/,inc42,2023-12-11T00:00:00.0000000Z
Will The Policy Bazooka Be Unleashed As Lines In The Sand Are Crossed?,"Hong Kong had a challenging session except for cell phone camera maker <b>Sunny Optical</b>, which gained +8.74%, as Hong Kong growth stocks were off, though everything was as well. JD’s poor outlook ...",https://www.forbes.com/sites/brendanahern/2023/10/19/will-the-policy-bazooka-be-unleashed-as-lines-in-the-sand-are-crossed/,Forbes,2023-10-19T13:47:00.0000000Z
"Zhejiang <b>Sunny Optical</b> Intelligent Technology Co., Ltd.","About Zhejiang <b>Sunny Optical</b> Intelligent Technology Co., Ltd. Sunny OIT is a subsidiary of <b>Sunny Optical</b> Technology Group. We are a robotic vision system solution provider covering a wide variety of use cases from the Metaverse to smart home, smart ...",https://www.arm.com/partners/catalog/zhejiangsunnyopticalintelligenttechnologycoltd,ARM architecture,2023-10-23T00:19:00.0000000Z
Exploring 3 High Growth Tech Stocks In Hong Kong,"As global markets react to China&#39;s robust stimulus measures, the Hong Kong market has seen a notable uptick, with the Hang Seng Index gaining 13% recently. This positive sentiment provides an opportune backdrop for exploring high-growth tech stocks in Hong Kong,",https://uk.finance.yahoo.com/news/exploring-3-high-growth-tech-090618205.html,Yahoo Finance,2024-08-27T23:35:00.0000000Z
"Apple supplier Jabil to set up Rs 2,000 crore mfg unit in Tiruchirapalli","Reports suggest that 14 companies, including Luxshare, <b>Sunny Optical</b>, Han’s Laser Technology, YUTO Packaging Technology, Strong, Salcomp, and Boson, have approached the government for initial clearance.",https://www.business-standard.com/industry/news/apple-supplier-jabil-to-set-up-rs-2-000-crore-mfg-unit-in-tiruchirapalli-124091000078_1.html,Business Standard,2024-09-11T02:01:00.0000000Z
{Hot Stocks} Blue Chips of price swing in pre-opening (2),"ET Net News Agency, 7 October 2024] 5 listed companies see active trades and price swing at 9:20am Listed companies Price Change(%) Status ---------------------------------------",https://www.etnet.com.hk/www/eng/warrants/realtime/quote_news_detail.php?newsid=ETE341007285&code=28142,經濟通ET Net,2024-07-10T09:22:00.0000000Z
{Hot Stocks} Blue Chips of price swing at 9:34am (2),CHOW TAI FOOK (01929) HK$8.08 -5.94 - Active selling orders account for 67% ANTA SPORTS (02020) HK$103.50 -2.63 - Active selling orders account for 46% <b>SUNNY OPTICAL</b> (02382) HK$59.55 -4.41 - Hitting an 1-month high - Active selling orders account for 62% ...,https://www.etnet.com.hk/www/eng/stocks/realtime/quote_news_detail.php?section=related&code=01929&newsid=ETE341008425,經濟通ET Net,2024-10-08T01:56:00.0000000Z
<b>SUNNY OPTICAL</b> (02382.HK) Aug Handset Lens Sets Shipments Hike 14.6% YoY,"SUNNY OPTICAL (02382.HK) announced that its shipment of handset lens sets in July reached 124 million units, up 7.5% MoM and 14.6% YoY, mainly due to weak demand in the overall sma... SUNNY OPTICAL (02382.",http://www.aastocks.com/en/stocks/news/aafn-news/NOW.1380078/,阿思達克財經網,2024-09-09T11:16:00.0000000Z
Apple Supplier Jabil Begins Making AirPods Components In India,"AirPods assembler Luxshare Precision Industry, lens manufacturer <b>Sunny Optical</b> Technology Group, Han’s Laser Technology Industry Group and Shenzhen YUTO Packaging Technology are a few of them.",https://inc42.com/buzz/apple-supplier-jabil-begins-making-airpods-components-in-india/,inc42,2023-01-29T23:59:00.0000000Z
<b>Sunny Optical</b> Technology Announced 2024 Interim Results,"HONG KONG, Aug 21, 2024 - (ACN Newswire) - <b>Sunny Optical</b> Technology (Group) Company Limited (the “Company”, together with its subsidiaries, the “Group”) (stock code: 2382.HK), a global-leading integrated optical components and products producer ...",https://www.jcnnewswire.com/english/pressrelease/92322/2/Sunny-Optical-Technology-Announced-2024-Interim-Results,JCN Newswire,2024-08-21T03:27:00.0000000Z
M5 MacBook expected to launch in 2025 to be equipped with a new compact camera module0 0,"According to analyst Ming-Chi Kuo, the compact camera module (CCM) will be supplied by Apple&#39;s Vietnamese supplier, <b>Sunny Optical</b>. This is pretty interesting because Apple had to cancel the ...",https://www.neowin.net/news/m5-macbook-expected-to-launch-in-2025-to-be-equipped-with-a-new-compact-camera-module/,Neowin,2024-07-17T14:07:00.0000000Z
Jabil to set up Rs 2K cr electronics unit in TN,"Reports suggest that 14 companies, including Luxshare, <b>Sunny Optical</b>, Han’s Laser Technology, YUTO Packaging Technology, Strong, Salcomp, and Boson, have approached the government for initial ...",https://www.rediff.com/business/report/jabil-to-set-up-rs-2k-cr-electronics-unit-in-tn/20240911.htm,rediff.com,2024-09-11T20:42:00.0000000Z
