Title,Description,URL,Provider,Date Published
"&#39;One or two runs short&#39;: Voss explains <b>TDK</b> sub call, where it went wrong",CARLTON coach Michael Voss has defended the Blues&#39; decision to make six changes ahead of their elimination final and declared ruckman Tom De Koning was only able to be selected as the substitute after a lay-off with a foot injury. The Blues&#39; season ended ...,https://www.afl.com.au/news/1214008/one-or-two-runs-short-michael-voss-explains-tom-de-koning-sub-call-where-it-went-wrong,Australian Football League,2024-09-07T00:00:00.0000000Z
"The 15 greatest posthumous albums, ranked","Critics have argued that <b>TDK</b> – released under the artist name Makaveli – is Tupac’s personal statement, in contrast to his acclaimed fourth record, 1996’s All Eyez On Me, which represented Death Row and the West Coast. Now his eye was fixed firmly ...",https://www.msn.com/en-us/music/news/the-15-greatest-posthumous-albums-ranked/ar-AA1riksK,The Independent on MSN.com,2024-09-27T05:00:00.0000000Z
<b>TDK</b> develops &quot;spin-memristor&quot; for neuromorphic devices,"The element mimics the energy-efficient operation of the human brain and could cut the power consumption of AI applications to around 1/100th of traditional devices, according to <b>TDK</b>. Collaborating with the French research organisation CEA (Alternative ...",https://www.newelectronics.co.uk/content/news/tdk-develops-spin-memristor-for-neuromorphic-devices,New Electronics,2024-10-07T00:00:00.0000000Z
GM looks to Japan’s <b>TDK</b> to make US batteries with China tech,"The factory would be funded and operated by <b>TDK</b>, a Japanese company that makes components for consumer electronics, said the sources, who asked not to be identified discussing information that’s private. The plant is expected to be located in the US ...",https://www.businesstimes.com.sg/companies-markets/transport-logistics/gm-looks-japans-tdk-make-us-batteries-china-tech,Business Times,2024-09-13T07:05:00.0000000Z
SMD choke for currents up to 48 A,"TDK Corporation has extended its EPCOS ERU27M series of SMD high-current flat-wire inductors consisting of an isolated alloy powder core and flat-wire helical winding. As power densities and currents in automotive and industrial applications continue to increase,",https://www.dataweek.co.za/22971r,Dataweek,2024-08-30T00:00:00.0000000Z
Collection of Arduino sketches for <b>TDK</b>&#39;s combo accel/gyro motion sensor,These and others APEX functions are explained in detail in <b>TDK</b>&#39;s AN-000173 &quot;ICM-426xx APEX Motion Functions: Description and Usage&quot; available on <b>TDK</b>&#39;s ICM42688 product page. The 6DoF sketch puts the magnetometer in powerdown mode and uses a 6 DoF (accel ...,https://github.com/kriswiner/ICM42688,GitHub,2022-01-16T22:05:00.0000000Z
Replacing the <b>TDK</b> 78P7200/2241 with the DS3150 Line Interface Unit,"This application note provides the information required to use the DS3150 line interface unit (LIU) in place of the <b>TDK</b> 78P7200, <b>TDK</b> 78P200L, and <b>TDK</b> 78P2241. The DS3150 LIU performs all the functions necessary for interfacing at the physical layer to T3 ...",https://www.analog.com/jp/resources/technical-articles/replacing-the-tdk-78p72002241-with-the-ds3150-line-interface-unit.html,Analog,2001-05-11T00:00:00.0000000Z
Ferrite Beads Demystified,"Figure 3. (a) The effect of dc bias current on bead inductance and impedance curves with respect to dc bias current for: (b) a <b>TDK</b> MPZ1608S101A bead, and (c) a Würth Elektronik 742 792 510 bead. For effective power supply noise filtering, a design ...",https://www.analog.com/en/resources/analog-dialogue/articles/ferrite-beads-demystified.html,Analog,2021-08-21T21:41:00.0000000Z
First 100 µF MLCC in 0603 packaging,Murata is expanding its range of multilayer ceramic capacitors (MLCC) with the groundbreaking new GRM188C80E107M and GRM188R60E107M.,https://www.dataweek.co.za/22970r,Dataweek,2024-08-30T00:00:00.0000000Z
TriLite looking to scale production with Continental backing,"The startup has qualified a high-volume manufacturing services platform based around partnerships with key suppliers, including MEMS mirrors from Infineon and <b>TDK</b>, RGB laser modules from ams Osram, and ultra-thin waveguides from Finland’s Dispelix.",https://optics.org/news/15/9/30,Optics,2024-09-19T00:00:00.0000000Z
DS90UB971-Q1: Design specifications of PoC filter current and S-parameter,"Many are for 97x, with some for 95x in this document &amp; device datasheet. Solutions are from various vendors including <b>TDK</b>, Coilcraft, Murata, etc. 1. My customer are currently investigating FAKRA Connector. Considering the S parameter specifications of ...",https://e2e.ti.com/support/interface-group/interface/f/interface-forum/1353751/ds90ub971-q1-design-specifications-of-poc-filter-current-and-s-parameter,Texas Instruments,2024-09-25T22:52:00.0000000Z
