Title,Description,URL,Provider,Date Published
"Robust analogue AI separates music, speech and noise","TDK has created a spin-memristor for analogue neural networks, and built a network that can separate three types of sound in real-time. It has been",https://www.electronicsweekly.com/news/research-news/robust-analogue-ai-separates-music-speech-and-noise-2024-10/,Electronics Weekly,2024-10-02T11:29:00.0000000Z
"Global Industrial Power Supply Market Size Anticipated to Exceed USD 21.5 Billion by 2034, Growing at 10.1% CAGR | FMI Study","The industrial power supply market is estimated to be worth USD 8.2 billion in 2024 and is projected to be valued at USD 21.5 billion in 2034. Between 2024 and 2034, the industry is poised to rise at a CAGR of 10.",https://www.fmiblog.com/2024/10/08/global-industrial-power-supply-market-size-anticipated-to-exceed-usd-21-5-billion-by-2034-growing-at-10-1-cagr-fmi-study/,Future Market Insights,2024-10-08T14:58:00.0000000Z
StoreDot&#39;s EV Battery Customization Takes Off: 5 Major Automakers On Board,"StoreDot, the pioneer in extreme fast charging (XFC) silicon battery technology for electric vehicles (EVs), enters Q4 of 2024 with a string of key milestones and strategic partnerships highlighting the company&#39;s commercialization journey.",https://finance.yahoo.com/news/storedots-ev-battery-customization-takes-123000681.html,YAHOO!Finance,2024-10-08T12:39:00.0000000Z
Samsung&#39;s Galaxy Watches could get a massive battery life boost thanks to solid-state technology,"The maker of the Samsung Galaxy Watch 7, Samsung Galaxy Watch Ultra, and the new Samsung Galaxy Ring has reportedly developed &quot;the world&#39;s first ultra-small all-solid-state battery for wearable devices.&quot; That&#39;s according to a report from Business Korea, which says the tech has been dubbed a &quot;dream battery.&quot;",https://www.msn.com/en-us/news/other/samsung-s-galaxy-watches-could-get-a-massive-battery-life-boost-thanks-to-solid-state-technology/ar-AA1rw3TI,TechRadar on MSN.com,2024-10-01T09:16:53.0000000Z
<b>TDK Corp. ADR</b>,"The Price to Earnings (P/E) ratio, a key valuation measure, is calculated by dividing the stock&#39;s most recent closing price by the sum of the diluted earnings per share from continuing operations ...",https://www.wsj.com/market-data/quotes/TTDKY,Wall Street Journal,2024-09-30T00:00:00.0000000Z
‘Joker 2’ Flop In 2024 Threatens Worst-Case Future For DC Studios,"With another DC movie failing at the box office, is the future of DC Studios shared cinematic world at risk? And is even Batman no longer safe from the audience backlash?",https://www.forbes.com/sites/markhughes/2024/10/08/joker-2-flop-in-2024-threatens-worst-case-future-for-dc-studios/,Forbes,2024-10-08T17:48:00.0000000Z
Joseph Bousaba announced as CEO of InvenSense and General Manager of <b>TDK</b> MEMS Sensors Business Group,"Bousaba and prior InvenSense CEO Omar Abed coordinate a smooth transition to ensure continuity for partners and employees; SAN JOSE, Calif., /PRNewswire/ -- TDK Corpo",https://www.tmcnet.com/usubmit/2024/10/03/10083498.htm,TMCnet,2024-10-03T14:11:00.0000000Z
Walker &amp; Dunlop Provides $73M Construction Loan for Florida Multifamily Complex,"Oldacre McDonald and TDK Construction secured a $72.7 construction loan for Vintage Lake Powell, a 289-unit apartment in Panama City Beach",https://commercialobserver.com/2024/10/walker-dunlop-provides-73m-construction-loan-florida-multifamily-complex/,Commercial Observer,2024-10-07T16:16:00.0000000Z
Oldacre McDonald and <b>TDK</b> Secure $72M for Panama City Beach Apartment,"Oldacre McDonald, LLC and TDK Construction, LLC have been awarded a $72 million construction loan to support the development of a mixed-use apartment complex in Panama City Beach, Florida.",https://www.globest.com/2024/10/04/oldacre-mcdonald-and-developer-in-panama-city-beach-get-72m-loan/,GlobeSt.com,2001-01-01T00:00:00.0000000Z
"GM in talks to buy EV batteries built with Chinese tech in US, source says","In GM&#39;s case, the proposed plant would be funded and operated by Japanese consumer electronic firm <b>TDK</b> Corp (6762.T), opens new tab, Bloomberg News reported, and is expected to be located in the ...",https://www.reuters.com/business/autos-transportation/gm-talks-buy-chinese-ev-batteries-built-us-bloomberg-news-reports-2024-09-12/,Reuters,2024-09-12T17:17:00.0000000Z
<b>Automotive Electronics</b>,"Bel Fuse has announced 4kW liquid-cooled dc-dc converter for low voltage accessories in hybrid and electric vehicles. Called 350DNG40-12-8, it can deliver between 10 and 15Vdc from 240 to 450Vdc at up to 93% efficiency with full galvanic isolation between ...",https://www.electronicsweekly.com/market-sectors/automotive-electronics/,Electronics Weekly,2024-10-03T00:00:00.0000000Z
GM looks to buy U.S. batteries made with tech from China&#39;s CATL,"The factory would be funded and operated by <b>TDK</b> Corp., a Japanese company that makes components for consumer electronics, said the people, who asked not to be identified discussing information ...",https://www.detroitnews.com/story/business/autos/general-motors/2024/09/13/gm-looks-to-buy-u-s-batteries-made-with-tech-from-chinas-catl/75205318007/,Detroit News,2024-09-13T00:00:00.0000000Z
<b>Hon Hai Precision Industry Co Ltd 2317</b>,We sell different types of products and services to both investment professionals and individual investors. These products and services are usually sold through license agreements or subscriptions ...,https://www.morningstar.com/stocks/XTAI/2317/quote,Morningstar,2024-10-04T00:00:00.0000000Z
CATL launches ultra-high-energy-density EV bus battery that lasts nearly 1 million miles,A third in the US could be possible with GM considering building a plant with Japan’s <b>TDK</b> that would license tech from CATL for LFP batteries.,https://electrek.co/2024/09/16/catl-launches-new-ev-battery-lasts-nearly-1-million-miles/,Electrek,2024-09-16T18:54:00.0000000Z
"Apple seeks more Indian partners, Flextronics, Jabil, Aequs plan to boost local production: Report","Moneycontrol could not independently verify the report. In 2022, Apple solidified its relationship with Japanese mobile battery maker <b>TDK</b>, becoming its first anchor client in India. <b>TDK</b> has since ...",https://www.moneycontrol.com/news/business/apple-seeks-more-indian-partners-flextronics-jabil-aequs-plan-to-boost-local-production-report-12817212.html,moneycontrol.com,2024-09-09T13:21:00.0000000Z
"Thornton’s Solid Power gets $50 million from feds to expand, prove out EV battery technology",Thornton&#39;s Solid Power EV battery maker won a $50 million grant to expand production and prepare for mass production of solid state technology.,https://coloradosun.com/2024/09/25/thornton-solid-power-ev-battery-maker-50-million/,coloradosun,2024-09-25T14:42:00.0000000Z
"CATL, the world leader in EV batteries, targets the global truck market","funded and operated by Japanese company <b>TDK</b> Corp.. More automakers from the United States and Europe are discussing potential partnerships with CATL, including both established manufacturers and ...",https://www.detroitnews.com/story/business/autos/2024/09/16/catl-the-world-leader-in-ev-batteries-targets-the-global-truck-market/75250380007/,Detroit News,2024-09-16T00:00:00.0000000Z
"With tech the top performing sector in 2024, these names could have more room to run",Discover the top 10 technology stocks for investors in 2024 with high quant ratings according to Seeking Alpha. Learn more here.,https://seekingalpha.com/news/4152678-with-tech-the-top-performing-sector-in-2024-these-names-could-have-more-room-to-run,Seeking Alpha,2024-09-27T12:31:00.0000000Z
GM Will Dump The &#39;Ultium&#39; Branding To Rethink How It Does Batteries: Exec,"GM is set to ditch the Ultium brand name amid a broad shift in battery strategy, an executive told Bloomberg. GM will continue using underlying batteries and technology platforms, but also incorporate LFP and nickel-rich prismatic cells.",https://www.msn.com/en-ph/news/other/gm-will-dump-the-ultium-branding-to-rethink-how-it-does-batteries-exec/ar-AA1rUsPt,InsideEVs Global on MSN.com,2024-10-08T16:40:23.0000000Z
"Inductor Market Projected to Reach US$ 21,417.5 Million by 2032, with a CAGR of 6.1%","Between 2017 and 2021, the global inductor market grew at a CAGR of about 2.9%. FMI forecasts the overall inductor market to grow at a 6.1% CAGR through 2032, owing to the rapid growth of the consumer electronics and automotive industries.",https://www.fmiblog.com/2024/10/03/inductor-market-projected-to-reach-us-21417-5-million-by-2032-with-a-cagr-of-6-1-4/,Future Market Insights,2024-09-06T19:40:00.0000000Z
Japanese Market Sharply Lower; Plunges 4%,"The Japanese stock market is trading sharply lower on Monday, giving up all the gains in the previous two sessions. The benchmark S&amp;P/ASX 200 is plunging more than 4 percent to",https://www.finanznachrichten.de/nachrichten-2024-09/63390467-japanese-market-sharply-lower-plunges-4-020.htm,Finanznachrichten,2024-09-30T02:50:00.0000000Z
"GM may buy Chinese EV batteries, but they will be made in the US","The deal would include Japan’s <b>TDK</b> licensing the tech from CATL to assemble at a new US plant. <b>TDK</b> would fund and operate the new plant to build lithium iron phosphate (LFP) cells, the sources ...",https://electrek.co/2024/09/12/gm-buy-chinese-ev-batteries-made-in-us/,Electrek,2024-09-12T17:59:00.0000000Z
Nashik News: Discharge from 12 Projects Starts; Three Suicides Reported; Initiation of STEM Workshop for MVP Teachers And More,"After an eight-day hiatus, the rains returned with force in the district. The formation of a low-pressure area from Rajasthan and Kutch to Madhya Maharashtra has resulted in increased rainfall across the entire state, including mild showers continuing in Nashik.",https://www.freepressjournal.in/pune/nashik-news-discharge-from-12-projects-starts-three-suicides-reported-initiation-of-stem-workshop-for-mvp-teachers-and-more,The Free Press Journal,2024-09-27T12:34:00.0000000Z
Drake&#39;s opens as dining anchor in Murfreesboro&#39;s Clari Park,"Drake&#39;s opened Monday in Murfreesboro&#39;s Clari Park development, inviting locals to their unique concept known as &quot;a restaurant that loves beer and a bar that loves food,&quot; according to a recent media release. &quot;Specializing in beer, burgers and sushi; Drake’s offers something for everyone,&quot; the release said.",https://www.msn.com/en-us/foodanddrink/foodnews/drakes-opens-as-dining-anchor-in-murfreesboros-clari-park/ar-AA1rB9vW,The Daily News Journal (Murfreesboro) on MSN.com,2024-10-02T18:36:00.0000000Z
Marco Ballini,"He was an Analog IC Designer and a Senior Researcher with imec, Leuven, Belgium. In 2021, he joined <b>TDK</b> InvenSense, Milan, Italy, where he is currently a System Design Engineer and an ASIC Architect (Senior Staff). His research interests include low-noise ...",https://ieeexplore.ieee.org/author/37573390300,IEEE,2019-10-22T23:29:00.0000000Z
"Japan’s Nikkei posts 3-week closing high on Wall Street strength, dovish BOJ",TOKYO: Japan’s Nikkei share average rose on Tuesday to a three-week closing high as markets resumed trade after,https://www.brecorder.com/news/40323704/japans-nikkei-hits-3-week-high-on-wall-street-strength-dovish-boj,Business Recorder,2024-09-24T07:59:00.0000000Z
"Smart Material Market Is Set For A Potential Growth Worldwide: APC International, Ltd., Metglas, Kyocera Corporation","(MENAFN- EIN Presswire) Smart Material market is Estimated to Generate $72.63 Billion by 2022 - Allied Market Research Smart materials are materials that can change their properties or behaviors in response to external stimuli, such as temperature ...",https://menafn.com/1108681414/Smart-Material-Market-Is-Set-For-A-Potential-Growth-Worldwide-APC-International-Ltd-Metglas-Kyocera-Corporation,Mena FN,2024-09-17T04:16:00.0000000Z
"Nikkei Rises 1.9%, Led by Heavy-Industry Manufacturers, Electronics Makers","Among the best performers on the Nikkei, Kawasaki Heavy Industries jumped 8.3% and Mitsubishi Heavy Industries climbed 7.8% while <b>TDK</b> and Rohm rose 6.8% each. USD/JPY was at 144.25, up from 143.64 late Monday in New York. The JGB 10-year yield was ...",https://www.wsj.com/world/asia/nikkei-may-open-higher-focus-on-ishiba-770ba335?mod=e2twe,Wall Street Journal,2024-10-01T00:00:00.0000000Z
"GM in talks to buy EV batteries built with Chinese tech in US, source says","In GM&#39;s case, the proposed plant would be funded and operated by Japanese consumer electronic firm <b>TDK</b> Corp, Bloomberg News reported, and is expected to be located in the south of the United States and to create more than 1,000 jobs. Talks are still ...",https://ca.finance.yahoo.com/news/gm-talks-buy-chinese-ev-153327048.html,Yahoo Finance,2024-09-11T23:59:00.0000000Z
Nikkei Rises as Japanese Stocks Reverse Slump,"Japan&#39;s Nikkei Stock Average rose 1.9% to close at 38651.97, led by heavy-industry manufacturers and electronics companies. The reversal of Monday&#39;s selloff in stocks and bonds was probably &quot;fueled by",https://www.barrons.com/livecoverage/stock-market-today-10012024/card/nikkei-rises-as-japanese-stocks-reverse-slump-fbUAKBDmHebRIpLA0ej4,Barron&#39;s,2024-10-01T09:10:00.0000000Z
Spin memristor mimics brain for energy efficiency in AI,"<b>TDK</b> developed this “spin-memristor” as the basic element of a neuromorphic device in collaboration with the French research outfit CEA. It’s apparent by now that energy consumption utilizing big data and AI will boom, inevitably leading to complexity ...",https://www.edn.com/spin-memristor-mimics-brain-for-energy-efficiency-in-ai/,EDN,2024-10-04T00:00:00.0000000Z
"Bottomline: VC-backed Fasal doubles revenue in FY24, keeps loss in check","Agritech startup Fasal, which is backed by the likes of Omnivore Venture Partners, 3one4 Capital, <b>TDK</b> Ventures, and British International Investment (BII), nearly doubled its revenue in the financial year ended March 2024 while still managing to keep a ...",https://www.vccircle.com/bottomlinevc-backed-fasal-doubles-revenue-in-fy24-keeps-loss-in-check,VCCircle,2024-09-11T23:59:00.0000000Z
Richard J. Przybyla,"In 2018, Chirp Microsystems was acquired by <b>TDK</b> Corporation, a global leader in sensor technology and electronic components. He has also held R&amp;D positions at Hewlett-Packard and Oregon State University. In 2019, he was inducted into the Oregon State ...",https://ieeexplore.ieee.org/author/37399402800,IEEE,2020-06-04T05:49:00.0000000Z
Aspen Aerogels: Current Valuation Is Not A Good Risk/Reward,"Aspen Aerogels&#39; valuation appears overly optimistic, not adequately accounting for risks. Book value lacks a sufficient margin of safety. Read more on ASPN stock here.",https://seekingalpha.com/article/4723383-aspen-aerogels-current-valuation-not-good-riskreward,Seeking Alpha,2024-09-26T10:26:00.0000000Z
GM Eyes Affordable Electric Pickup With 350-Mile Range,"The Detroit-based automaker is working to secure a North American supply of lithium iron phosphate (LFP) batteries, according to its vice president of battery strategy.",https://www.ttnews.com/articles/gm-eyes-affordable-ev-pickup,Transport Topics,2024-10-08T20:31:00.0000000Z
General Motors negocia compra de baterías chinas fabricadas en EE.UU. por japonesa <b>TDK</b>,"La fábrica sería financiada y operada por <b>TDK</b> Corp, una empresa japonesa que fabrica componentes para electrónica de consumo, dijeron las personas, que pidieron no ser identificadas debido a la ...",https://www.bloomberg.com/news/articles/2024-09-12/general-motors-negocia-compra-de-baterias-chinas-hechas-en-eeuu,Bloomberg L.P.,2024-09-11T23:59:00.0000000Z
GM Looks to Japan’s <b>TDK</b> to Make US Batteries with China Tech (1),"The factory would be funded and operated by <b>TDK</b> Corp., a Japanese company that makes components for consumer electronics, said the people, who asked not to be identified discussing information that’s private. The plant is expected to be located in the US ...",https://news.bloomberglaw.com/mergers-and-acquisitions/gm-in-talks-to-buy-chinese-batteries-made-in-us-by-japans-tdk,news.bloomberglaw,2024-09-12T19:46:00.0000000Z
Upcoming Stock Splits This Week (October 7 to October 11) – Stay Invested,"These are the upcoming stock splits for the week of October 7 to October 11, based on TipRanks’ Stock Splits Calendar. A stock split is a",https://www.msn.com/en-in/money/other/upcoming-stock-splits-this-week-october-7-to-october-11-stay-invested/ar-AA1rPvck,MSN,2024-10-07T13:26:00.0000000Z
EMC Filtration Market Size To Reach USD 2.35 Billion At 5.15% CAGR By 2032 Driven By Rising Demand For Power Quality Solutions | Report By SNS Insider,"This growth is propelled by increasing regulatory standards for electromagnetic compatibility (EMC) in various industries, including automotive, tele",https://menafn.com/1108746779/EMC-Filtration-Market-Size-To-Reach-USD-235-Billion-At-515-CAGR-By-2032-Driven-By-Rising-Demand-For-Power-Quality-Solutions-Report-By-SNS-Insider,Mena FN,2024-10-04T13:02:00.0000000Z
Tcl Dev Kit (<b>TDK</b>),"Tcl Dev Kit (<b>TDK</b>) includes everything you need for fast development of self-contained, easily-deployable applications. Turn your Tcl programs into ready-to-run executables, starkits or starpacks, for Windows, Mac OS X, Linux, Solaris, AIX and HP-UX.",https://github.com/ActiveState/tdk,GitHub,2018-03-22T12:00:00.0000000Z
Your next Samsung Galaxy Watch could have incredible battery life,"According to an article in BusinessKorea, Samsung has developed a never-before-seen battery: an ultra-small, all-solid-state device they call a “dream battery.” The battery is expected to be first used in the Galaxy Ring and Galaxy Watch and is slated for mass production starting in the first half of 2026.",https://www.digitaltrends.com/mobile/your-next-samsung-galaxy-watch-could-have-incredible-battery-life/,Digital Trends,2024-10-01T17:00:00.0000000Z
Walker &amp; Dunlop Arranges $72.8M HUD-Insured Loan for Apartment Development in Panama City Beach,"Walker &amp; Dunlop has arranged a $72.8 million construction loan for Vintage Lake Powell, a 289-unit apartment development located at 24000 Panama City Beach Parkway in Panama City Beach. Keith Melton and David Strange of Walker &amp; Dunlop originated the HUD 221(d)(4) loan on behalf of the developers,",https://rebusinessonline.com/walker-dunlop-arranges-72-8m-hud-insured-loan-for-apartment-development-in-panama-city-beach/,Real Estate BusinessOnline,2024-10-03T15:25:00.0000000Z
GM Looks to Japan’s <b>TDK</b> to Make US Batteries with China Tech,"With Thorny Results US Driving and Congestion Rates Are Higher Than Ever An Affordable Nomadic Home Design Struggles to Adapt to Urban Life The factory would be funded and operated by <b>TDK</b> Corp., a ...",https://finance.yahoo.com/news/gm-looks-japan-tdk-us-171613394.html,Yahoo Finance,2024-09-12T13:17:00.0000000Z
<b>TDK Life on Record reviews</b> &amp; products,"The latest hi-fi, home cinema and tech news, reviews, buying advice and deals, direct to your inbox.",https://www.whathifi.com/au/products/tdk-life-on-record,What Hi-Fi?,2020-06-03T10:00:00.0000000Z
1U high AC power sources offer up to 3kVA output,"TDK-Lambda expands its GENESYS series with the introduction of new programmable AC power sources. The GAC and GAC-PRO models, rated at 2kVA and 3kVA, enhance the company’s test and measurement capabilities.",https://www.eeworldonline.com/1u-high-ac-power-sources-offer-up-to-3kva-output/,eeworldonline,2024-10-02T12:38:00.0000000Z
"EVs, China and an election make for a turbulent political stew for key Michigan industry",Electric vehicles and the batteries that power them are the future in the U.S. auto industry’s home state but for now serve as a flashpoint in the upcoming election from the presidential race on down.,https://www.crainsgrandrapids.com/news/manufacturing/evs-china-and-an-election-make-for-a-turbulent-political-stew-for-key-michigan-industry/,crainsgrandrapids,2024-10-08T17:03:00.0000000Z
International scholars gather for 10th Turkish language congress,The 10th International Turkish Language Congress commenced on Thursday with a ceremonial reading of the National Anthem at the new conference hall of,https://www.dailysabah.com/turkiye/international-scholars-gather-for-10th-turkish-language-congress/news,Daily Sabah,2024-09-27T09:53:00.0000000Z
GM Eyes US-Made Chinese Batteries In Deal With Japan&#39;s <b>TDK</b>: Report,"GM eyes deal with <b>TDK</b> that involves licensing battery tech from CATL, aiming to localize production and navigate US-China tech scrutiny. Additionally, the company is reportedly in talks to buy ...",https://www.benzinga.com/markets/equities/24/09/40839765/gm-eyes-us-made-chinese-batteries-in-deal-with-japans-tdk-report,Benzinga.com,2024-09-12T13:26:00.0000000Z
Trackers and Breakbeats: Exhibition celebrates Brain Records’ underground revolution,"Trackers and Breakbeats will shed light on the often overlooked role of Brain Records and its founder, Bizzy B, in shaping UK hardcore and jungle scenes.",https://londonnewsonline.co.uk/lifestyle/whats-on/trackers-and-breakbeats-exhibition-celebrates-brain-records-underground-revolution/,South London Press,2024-10-03T14:55:00.0000000Z
Automotive High Voltage Electric Capacitor Market,The automotive high voltage electric capacitor market is expected to grow at a CAGR of 6.0% during the forecast period of 2024 to 2032. As the electric vehicle,http://www.mobilecomputingtoday.co.uk/22046/automotive-high-voltage-electric-capacitor-market/,mobilecomputingtoday.co.uk,2024-09-27T08:23:00.0000000Z
GM looks to Japan’s <b>TDK</b> to make U.S. batteries with China tech,"The factory would be funded and operated by <b>TDK</b> Corp., a Japanese company that makes components for consumer electronics, said the people, who asked not to be identified discussing private ...",https://www.autonews.com/automakers-suppliers/gm-looks-japans-tdk-make-us-batteries-china-tech,Automotive News,2024-09-16T06:00:00.0000000Z
GM in Talks to Buy Chinese Batteries Made in US by <b>TDK</b>,"The factory would be funded and operated by <b>TDK</b> Corp., a Japanese company that makes components for consumer electronics, said the people, who asked not to be identified discussing information ...",https://www.ttnews.com/articles/gm-talks-catl-tdk,Transport Topics,2024-09-12T15:28:00.0000000Z
GM to source CATL based batteries in US,"The batteries would be produced in the southern US at a US funded factory operated by Japanese electronics manufacturer <b>TDK</b>, using technology licensed from CATL which is the world’s largest ...",https://www.just-auto.com/news/gm-to-source-catl-based-batteries-in-us/,Just Auto,2024-09-17T00:00:00.0000000Z
Japanese Market Sharply Higher; Up 2%,"Recouping the losses in the previous session, the Japanese market is sharply higher on Thursday, following the broadly positive cues",https://markets.businessinsider.com/news/stocks/japanese-market-sharply-higher-up-2-1033816753,Business Insider,2024-10-03T04:27:00.0000000Z
"Lightspeed India is leading the way in AI, EV and climate-tech investments. Here&#39;s why","Lightspeed has doubled down on its focus on generative AI and AI-backed startups, investing $1.1 billion across 61 AI companies globally",https://www.forbesindia.com/article/startups/lightspeed-india-is-leading-the-way-in-ai-ev-and-climatetech-investments-heres-why/94242/1,Forbes India,2024-09-26T07:40:00.0000000Z
Japan’s <b>TDK</b> Corporation To Set Up Plant In India To Manufacture Batteries For iPhones,The facility will be of the same design as Apple’s other megafactories in China and is expected to begin production in 12–18 months The manufactured cells will be supplied to Sunwoda ...,https://inc42.com/buzz/japans-tdk-corporation-plant-india-manufacture-batteries-iphone/,inc42,2023-12-04T00:00:00.0000000Z
"General Motors, Alphabet, Trade Desk And An Energy Stock On CNBC&#39;s &#39;Final Trades&#39;","Additionally, the company is reportedly in talks to buy Chinese batteries made in the U.S. through its partnership with Japan&#39;s <b>TDK</b>. On Wednesday, UBS analyst Shneur Gershuni maintained Energy ...",https://www.benzinga.com/trading-ideas/long-ideas/24/09/40938321/general-motors-alphabet-trade-desk-and-an-energy-stock-on-cnbcs-final-trades,Benzinga.com,2024-09-19T09:00:00.0000000Z
Equipping design engineers with leading medical tech resources and products,"Seb Springall is a seasoned editor at Electropages, specialising in the product news sections. With a keen eye for the latest advancements in the tech industry, Seb curates and oversees content that highlights cutting-edge technologies and market trends.",https://www.electropages.com/2024/10/equipping-design-engineers-leading-medical-tech-resources-and-products,Electropages,2024-10-08T08:48:00.0000000Z
<b>TDK</b> Corporation releases digital MEMS accelerometer,"<b>TDK</b> Corporation has unveiled the AXO314, its latest addition to the Tronics AXO300 accelerometer platform. This digital MEMS accelerometer is designed for industrial applications operating under shock and vibration, with a ±14 g input range. The AXO314 ...",https://www.gpsworld.com/tdk-corporation-releases-digital-mems-accelerometer/,GPS World,2024-09-16T00:00:00.0000000Z
Japanese Market Sharply Lower,"The Japanese stock market is trading sharply lower on Wednesday, giving up the sharp gains in the previous session, following the",https://markets.businessinsider.com/news/stocks/japanese-market-sharply-lower-1033813116,Business Insider,2024-10-02T04:23:00.0000000Z
