Title,Description,URL,Provider,Date Published
"Hire T&amp;<b>TEC</b>, Irfaan","There I was, citizen Shah, last week Wednesday night, having secured the best seats money could never buy to watch my team, Trinbago Knight Riders, register a flogging on rivals",https://trinidadexpress.com/opinion/columnists/hire-t-tec-irfaan/article_68828312-8383-11ef-ae79-9b83db8bd7e4.html,Trinidad Express Newspapers,2024-10-06T01:36:00.0000000Z
Releases: Gaz-<b>tec</b>/Devourment-Refactor,Releases are now handled on our Nexus page where there is much better documentation for users. This Github will be used primarily for version control and for mod authors.,https://github.com/Gaz-tec/Devourment-Refactor/releases,GitHub,2023-01-04T00:00:00.0000000Z
West Cavan family business exports first trailers to Europe,"A family business based in west Cavan that manufactures trailers is growing its customer base in both Ireland and the UK, and has recently exported its",https://www.agriland.ie/farming-news/west-cavan-family-business-exports-first-trailers-to-europe/,agriland.ie,2024-10-05T12:00:00.0000000Z
Members <b>of the Technology Executive Committee</b>,"The <b>TEC</b> shall comprise 22 expert members, elected by the COP, serving in their personal capacity, and nominated by Parties with the aim of achieving a fair and balanced representation, as follows: • Ten members from Parties included in Annex I to the ...",https://unfccc.int/ttclear/tec/members.html,newsroom.unfccc.int,2018-05-19T08:40:00.0000000Z
Palfinger unveils two new heavy-duty cranes,"Palfinger has unveiled two new heavy-duty cranes, the PK 1350 TEC and PK 1650 TEC, designed for special and high load capacity applications. The entire",https://www.ivtinternational.com/news/construction/palfinger-unveils-two-new-heavy-duty-cranes.html,ivtinternational,2024-10-07T13:16:00.0000000Z
The variation characteristics and prediction performance of <b>TEC</b> in the geomagnetic latitude and local time coordinate,"Abstract: Total electron content (<b>TEC</b>), as one of the most valuable ionosphere parameters, has many variation characteristics. The <b>TEC</b> has specific characteristics at a given time, suggesting that the global <b>TEC</b> morphology distribution is maintained for a ...",https://ieeexplore.ieee.org/abstract/document/10005062,IEEE,2023-02-26T20:34:00.0000000Z
