Title,Description,URL,Provider,Date Published
Paramount Dye <b>Tec</b> Share Price,"Paramount Dye Tec, operating in the Textiles - General sector and classified as a Smallcap on the nse, currently has its share price at 102.1 The stock has experienced fluctuations today, with a low of ₹101.7 and a high of ₹104.55 Over the past 52 weeks, the shares have seen a low of ₹104.4 and a high of ₹109.9.",https://www.financialexpress.com/market/paramount-dye-tec-ltd-share-price/,The Financial Express,2024-10-09T05:44:00.0000000Z
SARMIS Capital takes over majority stake in Romanian paper producer MG-<b>TEC</b> Industry,"The investment fund SARMIS Capital took over the majority stake in the sanitary paper manufacturer MG-Tec Industry, located in central Romania at Dej, according to Ziarul Financiar. The transaction is one of the most important in this industry,",https://www.romania-insider.com/sarmis-capital-mgtec-industry-deal-october-2024,Romania Insider,2024-10-09T06:25:00.0000000Z
Police issue new appeal to help find New <b>Tec</b> man missing since last year,"Police are issuing another appeal for information more than a year after a New Tecumseth man was reported missing. Derek Perry was 34 when he was reported missing June 17, 2023. He is described as standing five-foot-11 with a medium build and short brown hair. He was known to frequent the Alliston and Barrie areas.",https://www.bradfordtoday.ca/police-beat/police-issue-new-appeal-to-help-find-new-tec-man-missing-since-last-year-9629053,bradfordtoday,2024-10-08T17:22:00.0000000Z
OPP renews appeal for information in case of missing New <b>Tec</b> man,"Derek Perry was 34 when he was reported missing June 17, 2023; police say he was known to frequent the Alliston and Barrie areas",https://www.barrietoday.com/police-beat/opp-renews-appeal-for-information-in-case-of-missing-new-tec-man-9629125,barrietoday,2024-10-08T17:36:00.0000000Z
"Paramount Dye <b>Tec</b> lists at ₹109 on NSE SME, 6% discount to IPO price","Paramount Dye Tec had a disappointing debut in the stock market today, October 8, as its shares opened on the NSE SME at ₹109.90 each, reflecting a 6% discount to the issue price of ₹117 per share.",https://www.msn.com/en-in/money/news/paramount-dye-tec-lists-at-109-on-nse-sme-6-discount-to-ipo-price/ar-AA1rRSyM,Live Mint on MSN.com,2024-10-08T05:23:46.0000000Z
Paramount Dye <b>Tec</b> lists at 6% discount over IPO price on NSE SME,Paramount Dye Tec SME IPO received robust investor interest after the issue was subscribed 50 times over three days.,https://www.moneycontrol.com/news/business/ipo/paramount-dye-tec-lists-at-6-discount-over-ipo-price-on-nse-sme-12837708.html,moneycontrol.com,2024-10-08T04:18:00.0000000Z
<b>New Skoda Octavia e-TEC 2021 review</b>,"The Octavia e-<b>TEC</b> is a fine first effort at mild-hybrid propulsion from Skoda. It drives smoothly, while the ride, refinement and practicality make a strong supporting case to the impressive ...",https://www.autoexpress.co.uk/skoda/octavia/354380/new-skoda-octavia-e-tec-2021-review,AutoExpress,2021-02-25T00:00:00.0000000Z
Paramount Dye <b>Tec</b> IPO: Steps to check allotment status online; latest GMP as focus shifts to listing,The bidding period for the IPO ended 3 October and allotment is to be out soon. Here are steps to check allotment status online; latest GMP as focus shifts to listing,https://www.msn.com/en-in/news/other/paramount-dye-tec-ipo-steps-to-check-allotment-status-online-latest-gmp-as-focus-shifts-to-listing/ar-AA1rHaSG,Mint on MSN.com,2024-10-04T22:23:00.0000000Z
ADS-<b>TEC</b> Energy Upgrades Convenience Stores with Ultra-Fast EV Charging at NACS Show 2024,"ADS-TEC Energy plc (NASDAQ: ADSE), a global leader in battery-buffered, ultra-fast charging technology, will be demonstr",https://www.businesswire.com/news/home/20240926125761/en/,Business Wire,2024-09-26T12:30:00.0000000Z
"Cyberabad police, IT industry leaders join hands to explore solutions for traffic congestion","The Cyberabad police, in a meeting with the representatives of the IT companies explored several actionable strategies that can be implemented for ease traffic situation in Hi-tec City area",https://telanganatoday.com/cyberabad-police-it-industry-leaders-join-hands-to-explore-solutions-for-traffic-congestion,Telangana Today,2024-10-07T15:38:00.0000000Z
NASA and SpaceX Postpone Europa Clipper Launch Due to Hurricane,"NASA and SpaceX have postponed the launch of the Europa Clipper mission, originally planned for October 10, because of expected hurricane conditions.",https://www.techopedia.com/news/nasa-and-spacex-postpone-europa-clipper-launch-due-to-hurricane,Techopedia,2024-10-07T11:26:00.0000000Z
"M2i Global, Inc. and NXT <b>TEC</b>. Ltd. Announce Strategic Partnership to Transform Global Construction and Critical Mineral Supply Chains","RENO, NV / ACCESSWIRE / October 2, 2024 /, Inc. (&quot;M2i,&quot; the &quot;Company,&quot; &quot;we,&quot; &quot;our&quot; or &quot;us&quot;) (OTCQB:MTWO), a company specializing in the development and execution of a complete global value supply chain for critical minerals,",https://finance.yahoo.com/news/m2i-global-inc-nxt-tec-123000099.html,YAHOO!Finance,2024-10-02T12:35:00.0000000Z
Attorney for Fort Bend County Judge KP George files motion to throw out indictment,George was indicted by a grand jury on a Class A misdemeanor charge of misrepresenting the identity of a candidate.,https://www.click2houston.com/news/local/2024/10/07/attorney-of-fort-bend-county-judge-kp-george-files-motion-to-throw-out-indictment/,Click2Houston,2024-10-08T03:10:00.0000000Z
This is the first smart lock to support ultra wideband,U-<b>tec</b> has announced a new smart lock that will allow your door to unlock automatically as you approach using ultra wideband (UWB) technology. While U-<b>tec</b> and other lock makers currently have auto ...,https://www.theverge.com/2024/9/13/24243694/ultraloq-bolt-mission-uwb-matter-smart-lock-apple-home,The Verge,2024-09-13T17:13:00.0000000Z
Putnam County students celebrate Manufacturing Day,"To celebrate Manufacturing Day, students from Columbus Grove donned their hard hats and were manufacturers for the day at PRO-TEC Coating Company.",https://www.limaohio.com/top-stories/2024/10/03/putnam-county-students-celebrate-manufacturing-day/,The Lima News,2024-10-03T18:00:00.0000000Z
Hispanic Heritage Month highlights impact of investing in diverse workforce development [opinion],"Workforce Development Month and Hispanic Heritage Month are great reminders of the critical need for more opportunities for skilled training, especially in Pennsylvania’s third-class cities, which have a high percentage of Hispanic residents.",https://www.readingeagle.com/2024/10/03/hispanic-heritage-month-highlights-impact-of-investing-in-diverse-workforce-development-opinion/,Reading Eagle,2024-10-03T13:00:00.0000000Z
TD Global Technology Leaders ETF,We sell different types of products and services to both investment professionals and individual investors. These products and services are usually sold through license agreements or subscriptions ...,https://www.morningstar.com/etfs/xtse/tec/portfolio,Morningstar,2021-02-05T13:01:00.0000000Z
Hi-<b>Tec</b> Oils Super Series 2024: Season 2024 Episode 9,"Live motorsport coverage of the Hi-Tec Oils Super Series Round 5, Part 1. Winton Motor Raceway, Victoria.",https://www.sbs.com.au/ondemand/sports-series/motorsport-hi-tec-oils-super-series-2024/motorsport-hi-tec-oils-super-series-2024/motorsport-hi-tec-oils-super-series-s2024-ep9/2372130371950,SBS,2024-09-22T13:00:00.0000000Z
"Thompson announces $30,000 ARC grant for Indiana center","Howard, announced this week that the Technology and Entrepreneurship Center along Philadelphia Street in Indiana will receive a $30,000 grant from the Appalachian Regional Commission to",https://www.wfmz.com/news/state/thompson-announces-30-000-arc-grant-for-indiana-center/article_a896cbce-70c5-5458-9932-7c0888a48fcc.html,WFMZ-TV,2024-10-04T04:20:00.0000000Z
BOLLINGER MOTORS DELIVERS FIRST FIVE CUSTOMER-READY ALL-ELECTRIC TRUCKS TO NACARATO TRUCK CENTERS,"Bollinger Motors, Inc. (&quot;Bollinger Motors&quot;), a commercial electric vehicle (&quot;EV&quot;) manufacturer, announced today the first customer delivery of its 2025 Bollinger B4 Chassis Cab. Bollinger Motors delivered five Bollinger B4s to Nacarato Truck Centers LaVergne,",https://finance.yahoo.com/news/bollinger-motors-delivers-first-five-133000889.html,YAHOO!Finance,2024-10-03T13:34:00.0000000Z
G-<b>Tec</b> Janix Education Ltd,Suzlon Energy Share Price Adani Enterprises Share Price,https://www.business-standard.com/markets/g-tec-janix-education-ltd-share-price-70833/announcements/nse-exchange-23979743,Business Standard,2024-09-30T06:28:00.0000000Z
"IPO Alert: Paramount Dye <b>Tec</b> IPO Subscription Status, GMP, Allotment Date, And Full Review | Paisa Live","If you are considering investing, Paramount Dye Tec is presenting an exciting IPO opportunity that could lead to significant profits. The IPO will be open for subscription from September 30, 2024, to October 3,",https://news.abplive.com/videos/business/ipo-ipo-alert-paramount-dye-tec-ipo-subscription-status-gmp-allotment-date-and-full-review-paisa-live-1721796,abp LIVE,2024-10-04T00:28:00.0000000Z
EQS-Media: ADS-<b>TEC</b> Energy Upgrades Convenience Stores with Ultra-Fast EV Charging at NACS Show 2024,"CET/CEST ADS-TEC Energy Upgrades Convenience Stores with Ultra-Fast EV Charging at NACS Show 2024 Demo of compact, battery-buffered ChargeBox, shows how c-stores",https://www.finanznachrichten.de/nachrichten-2024-09/63369228-eqs-media-ads-tec-energy-upgrades-convenience-stores-with-ultra-fast-ev-charging-at-nacs-show-2024-023.htm,Finanznachrichten,2024-09-26T12:35:00.0000000Z
Paramount Dye <b>Tec</b> shares to list today. GMP hints at marginal upside,"Paramount Dye Tec shares will debut on the NSE SME platform on Tuesday. The net proceeds from the public offer are slated for manufacturing units setup, debt repayment, land registry expenses, and general corporate purposes.",https://www.msn.com/en-in/money/news/paramount-dye-tec-shares-to-list-today-gmp-hints-at-marginal-upside/ar-AA1rRog9,The Economic Times on MSN.com,2024-10-08T02:45:37.0000000Z
Paramount Dye <b>Tec</b> IPO: All you need to know before subscribing,"Paramount Dye Tec&#39;s SME IPO has opened for subscription, aiming to raise Rs 28 crore through a fresh equity issue of 24.3 lakh shares. The company, which manufactures waste recycling fiber and yarn, offers shares at Rs 111-117 each.",https://economictimes.indiatimes.com/markets/stocks/news/paramount-dye-tec-ipo-all-you-need-to-know-before-subscribing/articleshow/113798091.cms,Indiatimes,2024-09-30T04:55:00.0000000Z
Terriers look to get back in the win column against Winnipeg Freeze,"A rocky start to the season has the Portage Terriers 2-4-0-0 so far, but a game tonight against the Winnipeg Freeze could get them closer to evening up their record. The Freeze have yet to record a win this season,",https://portageonline.com/articles/terriers-look-to-get-back-in-the-win-column-against-winnipeg-freeze,PortageOnline,2024-10-08T17:00:00.0000000Z
"Growing Ewing Township, NJ, Fire Department Eyes Staffing County Airport","And town officials told NJ Advance Media they continue to grow and would like to one day staff the firehouse at Trenton-Mercer Airport, the county-owned airport which is inside Ewing’s borders. Behind the growth is the mayor, Bert Steinmann, who was elected in 2010.",https://www.msn.com/en-us/news/us/growing-nj-fire-department-eyes-airport-firefighting-service-as-next-move/ar-AA1rP7eX,NJ.com on MSN.com,2024-10-07T14:26:00.0000000Z
Paramount Dye <b>Tec</b> Shares Hit 5% Lower Circuit After Weak Listing,"Ahead of the listing, the grey market premium or GMP of Paramount Dye Tec IPO was Rs 5, meaning a 4.27% premium over the issue price. According to InvestorGain, the projected listing price of the initial public offering of Paramount Dye Tec was Rs 122 apiece.",https://www.ndtvprofit.com/markets/paramount-dye-tec-shares-hit-5-lower-circuit-after-weak-listing,ndtvprofit,2024-10-08T06:31:00.0000000Z
Local resident files multiple <b>TEC</b> complaints against mayor and council,"A vocal critic of the Killeen mayor and City Council has been busily filing Texas Ethics Commission complaints, all of which have been dismissed.",https://kdhnews.com/news/local/local-resident-files-multiple-tec-complaints-against-mayor-and-council/article_899bb560-7d1f-11ef-85e2-cf6b51f2fcb6.html,Killeen Daily Herald,2024-09-27T23:00:00.0000000Z
UAE wealth fund starts operations in India&#39;s new finance hub,"Abu Dhabi Investment Authority (ADIA), the largest sovereign wealth fund in the United Arab Emirates (UAE), has started operations in an Indian tax-neutral finance hub, the government said on Monday.",https://www.reuters.com/business/finance/uae-wealth-fund-starts-operations-indias-new-finance-hub-2024-10-07/,Reuters,2024-10-07T11:23:00.0000000Z
Anna University developing indigenous diagnostic tool for cervical cancer detection,"Anna University has recently signed a Memorandum of Agreement (MoA) with Regenix Drugs, a Chennai-based pharmaceutical company, to facilitate transfer of a tech",https://www.msn.com/en-in/health/other/anna-university-developing-indigenous-diagnostic-tool-for-cervical-cancer-detection/ar-AA1rRoSu,Edexlive on MSN.com,2024-10-08T01:07:45.0000000Z
Ski-Doo Snowmobiles Prices and Values,Select a year and model below to get a valuation. Backcountry Adrenaline 600R E-<b>TEC</b> Cobra 1.6&quot; E.S. Backcountry Adrenaline 600R E-<b>TEC</b> PowderMax 2.0&quot; E.S. Backcountry Adrenaline 850 E-<b>TEC</b> Cobra 1.6&quot; E.S. Backcountry Adrenaline 850 E-<b>TEC</b> PowderMax 2.0&quot; E.S ...,https://www.jdpower.com/motorcycles/ski-doo/snowmobiles,jdpower,2017-03-01T17:11:00.0000000Z
"George&#39;s attorney seeks quashing of indictment, citing recent ruling",An attorney for Fort Bend County Judge KP George has filed a motion seeking that his recent indictment on a misdemeanor charge which alleges he knew about and possibly participated,https://www.fortbendstar.com/countynews/georges-attorney-seeks-for-indictment-to-be-quashed-citing-recent-ruling/article_ba89d34c-859d-11ef-8987-3fedee80665c.html,Fort Bend Star,2024-10-08T17:49:00.0000000Z
"Round 5, Day 1 - Live Stream - Hi-<b>Tec</b> Oils Super Series 2024",All the live action from Day 1 of Round 5 in the 2024 Hi-Tec Oils Super Series from Winton Raceway in Victoria.,https://www.sbs.com.au/ondemand/sports-program/round-5-day-1-live-stream-hi-tec-oils-super-series/2376296003857,SBS,2024-09-29T03:54:00.0000000Z
New high-<b>tec</b> mini golf course comes to Edina,"WCCO&#39;s Adam Del Rosso and Reg Chapman visit a brand new mini golf course in Edina, with amenities that are a hole in one.",https://www.yahoo.com/news/high-tec-mini-golf-course-131500054.html,Yahoo,2024-10-05T13:15:00.0000000Z
Paramount Dye <b>Tec</b> IPO Fully Subscribed On Day Two; Check GMP And Other Details,Paramount Dye Tec plans to use the funds raised from the IPO to set up a new manufacturing unit and settle debts.,https://www.ndtvprofit.com/ipos/paramount-dye-tec-ipo-day-two-subscription-status-and-gmp-details,ndtvprofit,2024-10-01T11:43:00.0000000Z
Technology Advisory Services,"<b>TEC</b> advisory services help organizations plan, select, and adopt the best enterprise software for their needs. See what differentiates us from other research and consulting companies. Learn more about best practices in technology projects and how we work.",https://www3.technologyevaluation.com/technology-advisory-services,TEC,2022-11-09T14:17:00.0000000Z
PUMM hosts competition to inspire young entrepreneurs,"The Persatuan Usahawan Maju Malaysia (PUMM) recently held its Entrepreneur’s Coliseum (TEC), a dynamic pitching competition specifically designed for youths under 30.",https://www.thestar.com.my/business/business-news/2024/10/04/pumm-hosts-competition-to-inspire-young-entrepreneurs,The Star,2024-10-03T21:28:00.0000000Z
"Upcoming IPOs: Two new public issues, six listings scheduled for next week; check list here","Garuda Construction will debut its public offering in the mainboard segment, while Shiv Texchem is preparing to enter the SME market.",https://www.msn.com/en-in/money/markets/upcoming-ipos-two-new-public-issues-six-listings-scheduled-for-next-week-check-list-here/ar-AA1rLWZR,Live Mint on MSN.com,2024-10-06T18:31:00.0000000Z
Why UC Merced says it is purchasing military equipment,"UC Merced is among the schools that purchase military equipment for policing students, raising concerns for some community members and civil rights groups – however, the university says the purchases are not related to or in preparation for any particular incident.",https://www.msn.com/en-us/news/us/why-uc-merced-says-it-is-purchasing-military-equipment/ar-AA1rC6uy,KSEE Fresno on MSN.com,2024-10-03T02:13:00.0000000Z
Abu Dhabi Investment Authority expands presence with subsidiary in GIFT City,"Dubai Abu Dhabi Investment Authority (ADIA), one of the world&#39;s largest sovereign wealth funds, has established a subsidiary in Gujarat International Finance Tec-City (GIFT City), India’s first operational smart city and International Financial Services Centre (IFSC).",https://thearabianpost.com/abu-dhabi-investment-authority-expands-presence-with-subsidiary-in-gift-city/,thearabianpost,2024-10-08T01:17:00.0000000Z
Technology Mechanism Initiative on Artificial Intelligence for Climate Action,"To further inform the work under the #AI4ClimateAction Initiative, the <b>TEC</b>, in 2023, convened regional consultations with national climate technology focal points, civil society, academia and business at the UNFCCC Regional Climate Weeks. At COP 28 ...",https://unfccc.int/ttclear/artificial_intelligence,newsroom.unfccc.int,2023-10-30T19:18:00.0000000Z
Telegram Launches Collectible Gifts With Blockchain integration,"Telegram now allows users to send gifts and convert them into blockchain-based assets. Launched on October 5, this feature lets users send gifts for Telegram Stars to celebrate holidays and congratulate contacts with animated art and custom messages.",https://www.techopedia.com/news/telegram-launches-collectible-gifts-with-blockchain-integration,Techopedia,2024-10-07T15:43:00.0000000Z
Abu Dhabi fund ADIA boosts global presence with GIFT City office,"ADIA will undertake a phased transfer of certain existing Indian investments to its GIFT City subsidiary, which will hold future Indian investments.",https://www.msn.com/en-ae/money/news/abu-dhabi-fund-adia-boosts-global-presence-with-gift-city-office/ar-AA1rShmW,Gulfbusiness.com on MSN.com,2024-10-08T07:00:00.0000000Z
Op-Ed: Texas courts changed how election laws are enforced. Lawmakers need to act,"Believe it or not, enforcing election laws just got harder in the Lone Star State. It’s been nearly three years since the landmark Stephens decision eviscerated the Attorney General’s ability",https://www.msn.com/en-us/news/other/op-ed-texas-courts-changed-how-election-laws-are-enforced-lawmakers-need-to-act/ar-AA1rQ6nE,The Center Square on MSN.com,2024-10-07T15:04:00.0000000Z
"The Executive Centre Reaches 50,000 Members","TEC achieves 50,000 Members, reflecting its exceptional workspace solutions- Celebrating 30 years of innovation and excellence in the industry- TEC continues to enhance Member experiences through premium servicesHONG KONG,",https://www.asiaone.com/business/executive-centre-reaches-50000-members,Asia One,2024-09-27T02:30:00.0000000Z
Pa. lawmakers hear of lives changed by <b>Tec</b> Centro in Lancaster,"Pennsylvania lawmakers visited one of Lancaster city’s two <b>Tec</b> Centro centers Thursday to learn how this locally developed, fast-growing model to scale bilingual workforce development is taking ...",https://lancasteronline.com/business/local_business/pa-lawmakers-hear-of-lives-changed-by-tec-centro-in-lancaster/article_20b1d436-bbd1-11ee-9ead-0ff2e5a9cb7d.html,LancasterOnline,2024-01-26T00:00:00.0000000Z
Networked HVAC <b>Thermostat Controllers</b>,"And, when the <b>TEC</b> is paired with CO2 sensors, the demand controlled ventilation feature allows the operator to choose a safe CO2 setpoint and monitor the building’s CO2 values over BACnet.",https://www.johnsoncontrols.com/building-automation-and-controls/hvac-controls/thermostats/networked-thermostat-controllers,Johnson Controls,2019-02-05T19:38:00.0000000Z
U-<b>tec</b> Ultraloq Bolt Mission UWB+NFC Smart Lock,"Related To: U-<b>tec</b> U-<b>tec</b>&#39;s smart lock that leverages ultra-wideband (UWB) technology, the Ultraloq Bolt Mission UWB+NFC, provides consumers with enhanced security, a seamless user experience ...",https://www.securityinfowatch.com/access-identity/access-control/locks/product/55139701/u-tec-u-tec-ultraloq-bolt-mission-uwbnfc-smart-lock,Security,2024-09-12T23:55:00.0000000Z
BSE SME Paramount Dye <b>Tec</b> makes a weak listing,"Shares of Paramount Dye Tec were trading at Rs 107.50 on the BSE, a discount of 8.12% compared with the issue price of Rs 117.",https://www.business-standard.com/markets/capital-market-news/bse-sme-paramount-dye-tec-makes-a-weak-listing-124100800544_1.html,Business Standard,2024-10-08T08:35:00.0000000Z
"Province flows $70M to Collingwood, New <b>Tec</b> for water plant",Simcoe-Grey MPP Brian Saunderson said the partnership between the two towns meant a higher investment from the province,https://www.bradfordtoday.ca/local-news/province-flows-70m-to-collingwood-new-tec-for-water-plant-9576892,bradfordtoday,2024-09-26T21:00:00.0000000Z
Putnam County host their 2nd annual Manufacturing Day for students,The day promotes manufacturing jobs in the county and the skills needed to get one of these great paying jobs.,https://www.hometownstations.com/news/putnam-county-host-their-2nd-annual-manufacturing-day-for-students/article_537309ae-81be-11ef-9479-c354de8de4fd.html,hometownstations,2024-10-03T19:50:00.0000000Z
Quest One opens new Gigahub and officially changes name from H-<b>TEC</b> SYSTEMS,"Gigahub Quest One has inaugurated its new Gigahub in Hamburg, Germany, dedicated to the serial and automated production of electrolysis stacks. With the opening of this new production site, the company,",https://energycentral.com/c/cp/quest-one-opens-new-gigahub-and-officially-changes-name-h-tec-systems,Energy Central,2024-09-30T15:31:00.0000000Z
"IHSE USA To Feature KVM Extenders, Switches at NAB Show New York","IHSE USA today will highlight its KVM extender and switch solutions at the 2024 NAB Show New York, Oct. 9-10, at the Javits Center in New York. The company will show the kvm-tec Scalable Pro Line for 10G/multiview applications,",https://www.tvtechnology.com/equipment/ihse-usa-to-feature-kvm-extenders-switches-at-nab-show-new-york,TV Technology,2024-10-04T12:56:00.0000000Z
"BPU, <b>TEC</b> team up on fast fiber project","The Paris Board of Public Utilities and a Mississippi-based communications company reached a tentative agreement Tuesday on a partnership that promises to bring high-speed broadband services to an estimated 10,",https://www.parispi.net/news/local_news/article_b7ed7c1a-7aa8-11ef-90a6-834d7dd42505.html,Paris Post-Intelligencer,2024-09-25T14:00:00.0000000Z
Decision Support System,"Mehdi Aftahi, <b>TEC</b>’s CTO and the leader of the Technology Advisory Services (TAS) department, created the decision support application <b>TEC</b> Advisor that empowers <b>TEC</b>’s data-driven software evaluation and selection projects. This online application is ...",https://www3.technologyevaluation.com/technology-advisory-services/decision-support-system,TEC,2023-02-27T21:04:00.0000000Z
Inspiring Education with Raspberry Pi,Discover how Marina Muñoz and Carlos Luna from Generación Tec are transforming education in Peru by empowering students with Raspberry Pi computers.,https://www.elektormagazine.com/news/inspiring-education-with-raspberry-pi,elektormagazine,2024-10-08T22:03:00.0000000Z
Hedge Fund Interest Grows in ADS-<b>TEC</b> Energy PLC (ADSE),"In this article, we are going to take a look at where ADS-TEC Energy PLC (NASDAQ:ADSE) stands against the other hot EV stocks to buy now. Just like any new technology, there is a lot of skepticism about the electric vehicle (EV) industry as well.",https://www.msn.com/en-us/money/savingandinvesting/hedge-fund-interest-grows-in-ads-tec-energy-plc-adse/ar-AA1rDdJx,Insider Monkey on MSN.com,2024-10-03T08:41:36.0000000Z
XChange <b>TEC</b>.INC Announces Entry into $25.0 Million Committed Equity Facility with VG Master Fund SPC,"XChange TEC.INC (NASDAQ: XHG) (the &quot;Company&quot;), today announced that on September 24, 2024, the Company entered into a Securities Purchase Agreement with VG Master Fund SPC (&quot;VG&quot;) pursuant to which the Company may from time to time sell VG up to $25.",https://www.asiaone.com/business/xchange-tecinc-announces-entry-250-million-committed-equity-facility-vg-master-fund-spc,Asia One,2024-09-24T13:24:00.0000000Z
Hi-<b>Tec</b> Oils Super Series Round 1,Save FREE DRINK + $7 SELECTED DRINKS - Super Size Tuesdays @ Soda to your collection. Share FREE DRINK + $7 SELECTED DRINKS - Super Size Tuesdays @ Soda with your friends. Save Glass Island - SUPER BOWL LIX - Mon 10 Feb 2025 to your collection. Share Glass ...,https://www.eventbrite.com.au/e/hi-tec-oils-super-series-round-1-tickets-827964142037,eventbrite.com.au,2024-03-01T06:02:00.0000000Z
Breezy Point breaks ground on city hall expansion,"The project includes a remodeling of the existing 4,100 square-foot city hall building and a 4,950-square-foot new addition.",https://www.pineandlakes.com/news/local/breezy-point-breaks-ground-on-city-hall-expansion,Pineandlakes,2024-10-02T21:08:00.0000000Z
