Title,Description,URL,Provider,Date Published
"<b>Tencent</b>, Guillemot family are said to consider buyout of Ubisoft","TENCENT Holdings and Ubisoft Entertainment’s founding Guillemot family are considering options including a potential buyout of the French video game developer after it lost more than half its market value this year,",https://www.businesstimes.com.sg/lifestyle/tencent-guillemot-family-are-said-consider-buyout-ubisoft,Business Times,2024-10-04T14:40:00.0000000Z
Chinese tech firms such as <b>Tencent</b> can create lifelike virtual avatars of you for a fee. But is it ethical?,"From virtual newsreaders to celebrity idols, the use of “digital people” has long been widespread in China. CNA meets educator Andrew Chin, who will be the first Singaporean outside the mainland to be turned into a digital avatar by Chinese tech giant Tencent,",https://www.channelnewsasia.com/east-asia/digital-human-tencent-ai-debate-4642366,Channel NewsAsia Singapore,2024-09-30T00:19:00.0000000Z
Balance between innovation and market adaptability is key to <b>Tencent</b> Cloud’s AI success,<b>Tencent</b> Cloud’s expansion in Asia Pacific (APAC) reflects its strategic efforts to capitalize on the growing demand for Artificial Intelligence (AI) and cloud computing services. According to ...,https://www.cio.com/article/3509599/balance-between-innovation-and-market-adaptability-key-to-tencent-clouds-ai-success.html,CIO,2024-09-10T00:00:00.0000000Z
<b>Tencent</b> Focuses on New IP Frontiers at INTA 2024 Annual Meeting,"<b>Tencent</b> is committed to helping brands harness the full potential of their IP. This includes new ways to engage consumers, like via video games, as well as through expansive communications services that connect over a billion users. <b>Tencent</b> will share its ...",https://www.tencent.com/en-us/media/inta-2024.html,Tencent,2024-05-22T12:01:00.0000000Z
Why <b>Tencent</b> Stock Is Plummeting Today,"Even on the heels of recent gains powered by government stimulus, Tencent stock is still down roughly 42% from its high. Meanwhile, the company grew its revenue and operating income 8% and 27% year over year, respectively, in its most recently reported quarter.",https://finance.yahoo.com/news/why-tencent-stock-plummeting-today-192301604.html,YAHOO!Finance,2024-10-08T19:30:00.0000000Z
China’s Government Takes Stake in a <b>Tencent</b> Domestic Unit,"China’s government has taken a stake in a domestic subsidiary of <b>Tencent</b>, the operator of WeChat, China’s biggest messaging app, in the latest step by Beijing to tighten its control over the country’s big tech firms. The government has taken a ...",https://www.theinformation.com/articles/chinas-government-takes-stake-in-a-tencent-domestic-unit,The Information,2023-10-18T18:39:00.0000000Z
"<b>Tencent</b>, Guillemot family mulling buyout of &#39;Assassin&#39;s Creed&#39; maker Ubisoft, Bloomberg News reports","Tencent Holdings and Ubisoft Entertainment&#39;s founding Guillemot family are considering options including a potential buyout of the &quot;Assassin&#39;s Creed&quot; maker, Bloomberg News reported on Friday. Guillemot Brothers and Tencent have been speaking with advisers to help bolster Ubisoft&#39;s value,",https://www.msn.com/en-us/money/companies/tencent-guillemot-family-mulling-buyout-of-assassins-creed-maker-ubisoft-bloomberg-news-reports/ar-AA1rHTvy,Reuters on MSN.com,2024-10-05T03:27:00.0000000Z
"GoTo Taps <b>Tencent</b> to Step up Its Cloud Infrastructure, Digital Services",GoTo Group has partnered with Chinese multinational tech conglomerate Tencent to enhance its cloud infrastructure and digital services,https://fintechnews.sg/101603/indonesia/goto-tencent-cloud-infrastructure/,Fintech Singapore,2024-09-23T03:37:00.0000000Z
"<b>Tencent</b>, NetEase rethink Japan approach as game strategy stalls","<b>TENCENT</b> Holdings and NetEase are reconsidering or scaling back many of their investments in Japanese studios, after years of spending yielded few hit games and the Chinese market staged a comeback. NetEase has cut all but a handful of jobs at its Ouka ...",https://www.businesstimes.com.sg/companies-markets/tencent-netease-rethink-japan-approach-game-strategy-stalls,Business Times,2024-08-31T13:33:00.0000000Z
Releases: <b>Tencent</b>/TencentKona-8,"openjdk version &quot;1.8.0_422&quot; OpenJDK Runtime Environment (<b>Tencent</b> Kona 8.0.19) (build 1.8.0_422-b1) OpenJDK 64-Bit Server VM (<b>Tencent</b> Kona 8.0.19) (build 25.422-b1, mixed mode, sharing)",https://github.com/Tencent/TencentKona-8/releases,GitHub,2022-11-21T02:24:00.0000000Z
Issues: <b>Tencent/cherry-markdown</b>,ProTip! Mix and match filters to narrow down what you’re looking for.,https://github.com/Tencent/cherry-markdown/issues/,GitHub,2024-08-07T02:20:00.0000000Z
<b>Tencent</b> Cloud launches Large Language Models-as-a-Service,"In order to help enterprises that want to integrate LLMs to solve problems such as high training costs, data security, and lack of expertise, <b>Tencent</b> Cloud launched a one-stop &quot;Model as a Service (MaaS)&quot; on Monday. <b>Tencent</b> Cloud MaaS provides multiple ...",https://en.pingwest.com/a/11863,PingWest,2023-06-19T18:53:00.0000000Z
Questionable Data Collection Is Why I Can Never Trust <b>Tencent</b>,"Tencent might become Ubisoft&#39;s savior, but exposing my data to non-optional, kernel-level software and spyware products is much worse.",https://exputer.com/features/tencents-data-collection/,eXputer,2024-10-08T19:50:00.0000000Z
<b>Tencent</b>’s Buyout Of Ubisoft Could Save The Company,"Despite Ubisoft&#39;s reputation and stock prices at their all-time low, Tencent may be the silver lining they need to make a fresh start.",https://exputer.com/features/tencent-buying-ubisoft/,eXputer,2024-10-07T09:21:00.0000000Z
