Title,Description,URL,Provider,Date Published
"Tata iPhone Plant Under Fire, Will Apple Go Back to China","A fire engulfed the Hosur, Tamil Nadu-based Tata iPhone component manufacturing plant. This has led to the shutdown of the plant and in turn the production till",https://www.analyticsinsight.net/news/tata-iphone-plant-under-fire-will-apple-go-back-to-china,Analytics Insight,2024-10-01T14:11:00.0000000Z
"After fire at Tata&#39;s Hosur plant, stockpiles steady iPhone production ship","Tata Electronics is investing Rs 6,000 crore in this plant, which will make Tata the second-largest iPhone assembler in India, following Foxconn. The fire did not impact this facility",https://www.business-standard.com/economy/news/after-fire-at-tata-s-hosur-plant-stockpiles-steady-iphone-production-ship-124100101260_1.html,Business Standard,2024-10-01T18:56:00.0000000Z
iPhone exports from India surge 54% to $5 bn for first 5 months of FY25,"Apple collaborates with three vendors—Foxconn, Pegatron, and <b>Wistron</b> (now Tata Electronics)—under the smartphone production-linked incentive (PLI) scheme, with a collective export commitment of US$ 8.9 billion for FY25. iPhone exports typically slow ...",https://www.ibef.org/news/iphone-exports-from-india-surge-54-to-5-bn-for-first-5-months-of-fy25,IBEF,2024-09-11T00:00:00.0000000Z
Aussies on Tour: Campbell leans on Scott for amateur farewell,Victorian Phoenix Campbell spent time with Adam Scott ahead of his amateur farewell at this week&#39;s Japan Open at Tokyo Golf Club.,https://www.golf.org.au/aussies-on-tour-campbell-leans-on-scott-for-amateur-farewell/,Golf Australia,2024-10-09T04:31:00.0000000Z
"Tata Sons invests ₹10,000 crore in arms in FY24","All the companies mentioned above are unlisted. With the exception of <b>Wistron</b>, which makes iPhones for Apple, most of the companies that Tata has invested over the last 4-5 years are still in the ...",https://www.thehindubusinessline.com/companies/tata-sons-invests-10000-crore-in-arms-in-fy24/article68618832.ece,Business Line,2024-09-08T00:00:00.0000000Z
Optiemus and <b>Wistron</b> join hands to invest $200mn to <b>set up telecom manufacturing facilities in India</b>,"Keeping in mind Indian government’s ‘ Make in India ’ initiative, Optiemus Infracom Limited and <b>Wistron</b> Corporation have announced a joint venture agreement to set up manufacturing ...",https://www.businessinsider.in/Optiemus-and-Wistron-announce-joint-venture/articleshow/49906912.cms,Business Insider India,2015-11-24T07:47:00.0000000Z
With or without Chinese companies is the question,"It began by taking over the India operations of <b>Wistron</b>, and have covered much ground in their negotiations to acquire Pegatron, both Taiwanese suppliers for corporations including Apple.",https://www.thehindu.com/opinion/op-ed/with-or-without-chinese-companies-is-the-question/article68619220.ece,The Hindu,2024-09-09T07:51:00.0000000Z
