Title,Description,URL,Provider,Date Published
<b>ZTE</b> Unveils Next-Gen AI-Powered FTTR Solutions,"ZTE, at the recent All-Optical Home Development Summit Forum, introduced the industry&#39;s first AI-enabled screen FTTR series products",https://www.thefastmode.com/technology-solutions/37476-zte-unveils-next-gen-ai-powered-fttr-solutions,Deep,2024-09-30T02:52:00.0000000Z
<b>ZTE</b> PHONES,"The company has made several Android smartphones and tablets. While the company mainly sells products under the <b>ZTE</b> brand, it is also an original equipment manufacturer (OEM). <b>ZTE</b>&#39;s latest mobile launch is the Nubia Z60S Pro. The mobile was launched in ...",https://www.gadgets360.com/mobiles/zte-phones,gadgets360,2024-10-06T00:00:00.0000000Z
<b>ZTE Corp</b>.,"<b>ZTE</b> is a major Chinese telecommunications equipment maker based in Shenzhen, Guangdong Province. It is often compared with its larger rival, Huawei Technologies. The company&#39;s three core ...",https://asia.nikkei.com/Companies/ZTE-Corp,Nikkei Asia,2015-12-24T18:11:00.0000000Z
<b>ZTE</b> Mobiles Price List,"Staying updated on the mobile price list is essential for anyone in search of the latest smartphone deals, especially when it comes to <b>ZTE</b> phones in India. <b>ZTE</b> releases new models, offering a wide range of choices to cater to different budgets and preferences.",https://www.gadgets360.com/mobiles/zte-price-list,gadgets360,2024-10-08T00:00:00.0000000Z
Sri Lanka smartphone market surges 218-pct in Q2 2024: IDC,"Sri Lanka’s market shipped 365 thousand units, with 218% YoY growth, showing a triple-digit growth trend for 5 consecutive quarters, market intelligence provider, the International Data Corporation (IDC) said.",https://www.lankabusinessonline.com/sri-lanka-smartphone-market-surges-218-pct-in-q2-2024-idc/,Lanka Business Online,2024-10-09T05:13:00.0000000Z
U Mobile and <b>ZTE</b> Partner for 5G in Rural Malaysia and Agriculture,"U Mobile partners with ZTE to boost 5G in rural Malaysia, enhancing connectivity and driving digital transformation in agriculture.",https://www.malaysianwireless.com/2024/09/u-mobile-zte-5g-rural-agriculture/,malaysianwireless.com,2024-09-30T08:08:00.0000000Z
Smart <b>ZTE</b> Blade A75 5G Review | Geek Lifestyle,"Smart Communications and global brand <b>ZTE</b> recently entered quite the surprising collaboration, and brought us the <b>ZTE</b> Blade A75 5G. This new, affordable smartphone comes in with the aim to deliver some solid 5G performance that one would otherwise find on ...",https://www.ungeek.ph/2024/09/smart-zte-blade-a75-5g-review-geek-lifestyle/,ungeek,2024-09-17T00:00:00.0000000Z
"<b>ZTE</b> Blade A35 Lite Full Specs, Features, Price In Philippines","ZTE BLADE A35 LITE - See ZTE Blade A35 Lite full specifications, features, colors, and prices in the Philippines here.",https://philnews.ph/2024/09/25/zte-blade-a35-lite-specs-features-price-philippines/,Philippine News,2024-09-25T08:17:00.0000000Z
<b>ZTE</b> <b>Mobile Price in Pakistan</b>,"The Mobile Industry has been marked as a strategic business of <b>ZTE</b>, especially <b>in Pakistan</b>. Due to the variety of inexpensive but technologically advanced devices, <b>ZTE</b> smartphones have received a great deal of attention among buyers. The <b>ZTE</b> mobile price ...",https://hamariweb.com/mobiles/zte,hamariweb,2024-10-04T00:00:00.0000000Z
Best monitor deals for October Prime Day 2024,"Amazon is featuring some fantastic sales on OLED monitors, gaming monitors, and office monitors for Prime Big Deal Days. We&#39;ve tracked the best discounts down for you.",https://www.msn.com/en-us/news/technology/best-monitor-deals-for-october-prime-day-2024/ar-AA1rTGbO,PC World on MSN.com,2024-10-08T13:37:31.0000000Z
Optical Transport Network Market In-Depth Analysis with Booming Trends Supporting Growth and Forecast 2022-2032,"An optical transport network is a collection of different elements that are collectively referred to as optical network elements. These elements are connected by optical fiber links, which facilitates multiplexing.",https://www.fmiblog.com/2024/10/07/optical-transport-network-market-in-depth-analysis-with-booming-trends-supporting-growth-and-forecast-2022-2032/,Future Market Insights,2024-10-07T11:44:00.0000000Z
<b>ZTE</b> Corporation: <b>ZTE</b> strengthens commitment to advancing a sustainable digital future for all at UN Summit of the Future,ZTE Vice President Summer Chen was invited to deliver a keynote speech at SDG Digital &quot;A Digital Future for All&quot; at United Nations HeadquartersZTE reinforces its strong commitment to advancing,https://www.finanznachrichten.de/nachrichten-2024-09/63362714-zte-corporation-zte-strengthens-commitment-to-advancing-a-sustainable-digital-future-for-all-at-un-summit-of-the-future-008.htm,Finanznachrichten,2024-09-26T04:01:00.0000000Z
Biden administration seeks ban on auto software from China,Biden administration seeks ban on auto software from China. This would effectively block the import of Chinese EVs.,https://sg.finance.yahoo.com/news/biden-administration-seeks-ban-on-auto-software-from-china-154025671.html,Yahoo Finance,2024-09-23T15:40:00.0000000Z
Pangilinan-led Smart targets broader 5G adoption with launch of low-cost 5G phone,"The company has partnered with <b>ZTE</b> Corp., a Chinese telecommunications equipment manufacturer known for its 5G technology, to offer the Smart <b>ZTE</b> Blade A75 5G, a smartphone designed to provide 5G capabilities at a lower cost. The Smart <b>ZTE</b> Blade A75 5G ...",https://www.bworldonline.com/corporate/2024/08/23/615751/pangilinan-led-smart-targets-broader-5g-adoption-with-launch-of-low-cost-5g-phone/,BusinessWorld,2024-08-22T16:07:00.0000000Z
ZTEST Electronics Inc. (<b>ZTE</b>.CN),"NORTH YORK, ON / ACCESSWIRE / September 24, 2024 / ZTEST Electronics Inc. (&quot;ZTEST&quot; or the &quot;Company&quot;) (CSE:<b>ZTE</b>) is pleased to announce that it will be presenting at the Planet MicroCap Showcase: VANCOUVER 2024, in association with Small Cap Discoveries.",https://ca.finance.yahoo.com/quote/ZTE.CN/,Yahoo Finance,2024-09-25T00:00:00.0000000Z
Report: 5G rollout slowed while MNOs await merger approval,Mobile operators around the world would like to merge four mobile networks in their respective nations into three. This would improve the business case for inve,https://advanced-television.com/2024/10/07/report-5g-rollout-slowed-while-mnos-await-merger-approval/,Advanced Television,2024-10-07T09:13:00.0000000Z
"Telecom Industry Vendor Performance Report 2024: Telco NI Vendor Revenues Down 9.7% YoY, Market Contracts Despite Huawei&#39;s Rebound",The &quot;Telecom&#39;s Biggest Vendors&quot; report has been added tAndMarkets.com&#39;s offering. The goal of this report series is to equip telecom industry decision-makers with a comprehensive view of spending trends and vendor market power in their industry.,https://sg.finance.yahoo.com/news/telecom-industry-vendor-performance-report-100200748.html,Yahoo Finance,2024-10-02T06:02:00.0000000Z
"Exclusive: Nubia V70 series surfaced, coming soon","The Nubia V70 series is a new smartphone series from ZTE. However, ZTE had previously launched two V-series smartphones, the Nubia V60 and V60 Design. The Nubia V60 and V60 Design were launched as budget smartphones with entry-level specifications. We expect the new Nubia V70 series to be a similarly budget-friendly smartphone.",https://www.gizmochina.com/2024/10/07/exclusive-nubia-v70-series-surfaced-coming-soon/,Gizmochina,2024-10-07T11:48:00.0000000Z
China property: Shanghai and Shenzhen luxury home sales soar after stimulus package,"The area is expected to serve as the new headquarters of technology and financial giants, including Oppo, <b>ZTE</b>, JD.com and Citic Group. The People’s Bank of China on Tuesday asked lenders to cut mortgage rates by half a point and cut the down payment for ...",https://www.thestar.com.my/aseanplus/aseanplus-news/2024/10/01/china-property-shanghai-and-shenzhen-luxury-home-sales-soar-after-stimulus-package,The Star,2024-10-01T14:00:00.0000000Z
"MTN, <b>ZTE</b> Launch Africa’s First 5G Maritime Network in Western Cape","Integrating technology into critical sectors is paving the way for more inclusive and resilient economies across the continent. By leveraging cutting-edge technologies, Africa is not only addressing its socio-economic challenges but also fostering long-term growth and environmental sustainability,",https://www.ecofinagency.com/telecom/2409-45929-mtn-zte-launch-africa-s-first-5g-maritime-network-in-western-cape,ecofinagency,2024-09-24T16:35:00.0000000Z
UNIFI DEVICE FIESTA: TICKET TO TECH HEAVEN,"IN an increasingly digital world, the importance of connectivity extends far beyond mere internet access. It shapes relationships, enhances well-being, and fosters community.",https://www.thestar.com.my/starpicks/2024/10/04/unifi-device-fiesta-ticket-to-tech-heaven,The Star,2024-10-04T09:41:00.0000000Z
"<b>ZTE</b> embraces digital solutions to connect rural, isolated regions","At the United Nations Summit of the Future 2024, ZTE VP Summer Chen said the company&#39;s digital solutions are bringing connectivity to some of the world’s most remote and underserved regions.",https://www.rcrwireless.com/20240926/5g/zte-embraces-digital-solutions-connect-rural-isolated-regions,RCR Wireless News,2024-09-26T14:54:00.0000000Z
"USD 16.84 Billion 5G Enterprise Market Reach By 2028 Top Players Such As - Ericsson, <b>ZTE</b> Corporation, Samsung, AT&amp;T","G Enterprise Market WILMINGTON, DE, UNITED STATES, October 3, 2024 /EINPresswire / -- Global 5G enterprise &lt;a target=_blank href=https:",https://menafn.com/1108742673/USD-1684-Billion-5G-Enterprise-Market-Reach-By-2028-Top-Players-Such-As-Ericsson-ZTE-Corporation-Samsung-ATT,Mena FN,2024-10-03T09:50:00.0000000Z
"Diamondbacks Beat Padres 11-2, Now They Wait","The Arizona Diamondbacks offense finally showed up, albeit a day late, as they defeated the San Diego Padres 11-2 on Sunday. Brandon Pfaadt threw 5.1 innings and struck out nine batters in a ...",https://www.si.com/mlb/diamondbacks/arizona-diamondbacks-game-day/diamondbacks-beat-padres-11-2-now-they-wait-01j8zte5wtjk,Sports Illustrated,2024-09-28T23:59:00.0000000Z
Freedom Holdings eyes Hong Kong’s dim sum bond market to fund Kazakh optic-fibre project,“Renminbi interest rate is lower than the US dollar’s rate and we will need this renminbi to pay Huawei” and <b>ZTE</b> Corp. for the Chinese companies’ euipment for fitting out its telecoms ...,https://www.scmp.com/business/banking-finance/article/3278150/freedom-holdings-eyes-hong-kongs-dim-sum-bond-market-fund-kazakh-optic-fibre-project,scmp.com,2024-09-12T16:15:00.0000000Z
"<b>ZTE</b> Blade V60 Design Full Specs, Features, Price In Philippines","ZTE BLADE V60 DESIGN - See ZTE Blade V60 Design full specifications, features, colors, and prices in the Philippines here.",https://philnews.ph/2024/10/02/zte-blade-v60-design-specs-features-price-philippines/,Philippine News,2024-10-02T08:44:00.0000000Z
America v China: who controls Asia’s internet?,"Since the second world war, America has dominated communications infrastructure. But its grip has slipped. China has become far more technologically autonomous in the past decade, according to a composite index of “digital dependence” that assesses hardware,",https://www.economist.com/asia/2024/10/08/america-v-china-who-controls-asias-internet,The Economist,2024-10-08T21:23:00.0000000Z
<b>ZTE</b> Nubia Focus 5G: Common Issues and Effective Solutions,"The ZTE Nubia Focus 5G has recently entered the smartphone market, boasting impressive specifications but not without its own set of challenges. Let’s explore some common issues reported by users and provide practical solutions to enhance your experience with the Nubia Focus 5G.",https://mobilityarena.com/zte-nubia-focus-5g-issues-and-solutions/,mobilityarena.com,2024-10-08T17:27:00.0000000Z
China’s small but beautiful ‘little giants’ charged with punching above their weight,"In China’s eastern coastal city of Ningbo lies a little-known manufacturer that makes one of the world’s thinnest amorphous-nanocrystalline alloys, more commonly known as magnetic “liquid metals”. The stand-out of the product line are soft,",https://www.msn.com/en-sg/news/other/china-s-small-but-beautiful-little-giants-charged-with-punching-above-their-weight/ar-AA1rRPJm,South China Morning Post on MSN.com,2024-10-07T06:15:08.0000000Z
MVP: 5G phones soon to be more affordable,"PLDT Inc. boss Manuel V. Pangilinan sees the price of 5G-capable phones going down, but said more work needs to be done to expand 5G usage among Filipinos.",https://www.philstar.com/business/2024/10/01/2389143/mvp-5g-phones-soon-be-more-affordable,philstar.com,2024-09-30T16:05:00.0000000Z
MTN Congo 5G Launch Leverages High-end Broadband Connectivity in Central Africa.,"While the Congolese 5G Network was being developed during its beta phase that was engineered by MTN’s stealth intervention, it’s worth noting that the old-timer Chinese tech firm <b>ZTE</b> also demonstrated impressive contributions on stealth by offering its ...",https://www.techbooky.com/mtn-congo-5g-launch-leverages-high-end-broadband-connectivity-in-central-africa/,techbooky.com,2024-10-08T00:00:00.0000000Z
"<b>ZTE</b> Blade A75 5G quietly launches, a version of the nubia Focus with a 50MP main lens","The phone gets its 5G connectivity from the Unisoc T760 chipset. It has a 6.6&quot; 120Hz IPS LCD with only HD+ resolution. Early this year, ZTE unveiled",https://www.gsmarena.com/zte_blade_a75_5g_quietly_launches_a_version_of_the_nubia_focus_with_a_50mp_main_lens-news-64745.php,GSM Arena,2024-10-01T10:14:00.0000000Z
"Vodafone Idea 4G/5G deal: Nokia says to increase market share; replacing Huawei, <b>ZTE</b> in key circles","In 2019, Nokia won nine circles from Vodafone Idea, while Ericsson bagged eight. Chinese gear vendors Huawei and ZTE bagged seven and five circles, respectively. All five circles of ZTE were shared with another vendor.",https://www.moneycontrol.com/news/telecom/vodafone-idea-4g5g-deal-nokia-says-to-increase-market-share-replacing-huawei-zte-in-key-circles-12831375.html,moneycontrol.com,2024-09-28T07:29:00.0000000Z
"U Mobile signs deals with Huawei, <b>ZTE</b> for vertical 5G use cases",Malaysian telco U Mobile said on Saturday it has scored separate deals with Chinese telecoms vendors Huawei and ZTE to explore and develop 5G use cases in Malaysia focused on verticals and the agriculture sector.,https://developingtelecoms.com/telecom-technology/enterprise-ecosystems/17377-u-mobile-signs-deals-with-huawei-zte-for-vertical-5g-use-cases.html,developingtelecoms.com,2024-09-30T06:43:00.0000000Z
<b>ZTE</b> and China Telecom to deploy 5G IoT solution at The First Affiliated Hospital,Chinese telecommunications company ZTE has partnered with China Telecom&#39;s Suzhou branch to install a 5G internet of things (IoT) solution at The First Affiliated Hospital of Soochow University.,https://finance.yahoo.com/news/zte-china-telecom-deploy-5g-143539924.html,YAHOO!Finance,2024-09-30T15:13:00.0000000Z
MTN and <b>ZTE</b> bringing 5G connectivity to South African coasts – by extending coverage 22km from land,G Ultra-range Maritime Coverage Project – how MTN determined how far it can extend its 5G network across territorial waters and what speeds it could achieve at this range.,https://mybroadband.co.za/news/industrynews/562063-mtn-and-zte-bringing-5g-connectivity-to-south-african-coasts-by-extending-coverage-22km-from-land.html,MyBroadband,2024-09-25T08:54:00.0000000Z
<b>ZTE</b> launches home network product portfolio at Network X 2024,"The solution addresses operators&#39; needs for networking, video and AI cloud management in the smart home sector.",https://www.itweb.co.za/article/zte-launches-home-network-product-portfolio-at-network-x-2024/nWJadMbNrnBMbjO1,ITWeb,2024-10-09T06:43:00.0000000Z
Prime Big Deal Days: Check Out These Awesome Phone Deals,"Amazon already makes the art of online shopping easier than it has ever been and buying into Amazon Prime adds further perks to what is already a good proposition. Well, if you happen to be on Amazon Prime,",https://www.talkandroid.com/491210-prime-big-deal-days-phones/,talkandroid.com,2024-10-08T17:22:00.0000000Z
"<b>ZTE</b> launches next-gen FTTR products, ushering in new era of smart homes","The AI FTTR all-optical series products enhance performance in connectivity, storage, computing power and ubiquitous screens.",https://www.itweb.co.za/article/zte-launches-next-gen-fttr-products-ushering-in-new-era-of-smart-homes/mYZRX79genZqOgA8,ITWeb,2024-09-30T06:54:00.0000000Z
<b>ZTE</b> strengthens commitment to advancing a sustainable digital future for all,ZTE leverages digital technologies to protect biodiversity alongside advancing meaningful connectivity and digital transformation globally.,https://www.itu.int/hub/2024/10/zte-strengthens-commitment-to-advancing-a-sustainable-digital-future-for-all/,ITU,2024-10-03T08:17:00.0000000Z
{Hot Stocks} HK MMA stocks of price swing at 10:35am (1),<b>ZTE</b> (00763) HK$21.85 -20.69 - Active selling orders account for 59% CMS (00867) HK$8.90 -10.28 - Active selling orders account for 64% - Falling a combined 11.18% over the past 2 consecutive days YANKUANG ENERGY (01171) HK$10.68 -10.10 - Hitting an 1-month ...,https://www.etnet.com.hk/www/eng/stocks/realtime/quote_news_detail.php?section=related&code=01918&newsid=ETE341008589,經濟通ET Net,2024-10-08T02:40:00.0000000Z
"Slotkin, Rogers spar in Michigan U.S. Senate debate. Here are the facts","Candidates for Michigan’s open U.S. Senate seat debated Tuesday. Here are the facts, and where they stand on key issues.",https://www.bridgemi.com/michigan-government/slotkin-rogers-spar-michigan-us-senate-debate-here-are-facts,Bridge Magazine,2024-10-09T02:02:00.0000000Z
<b>Yifei Yuan</b>,"He was with Lucent Technologies Bell Labs, Murray Hill, NJ, USA, from 2000 to 2008. From 2008 to 2020, he was a Technical Director and a Chief Engineer with <b>ZTE</b> Corporation, Shenzhen, China, responsible for standards and research of LTE-Advanced and 5G.",https://ieeexplore.ieee.org/author/37534121000,IEEE,2019-09-02T19:57:00.0000000Z
"<b>ZTE</b>, Smartfren partner on AI RAN integration",<b>ZTE</b> noted that the integration of AI into the Radio Access Network (RAN) allows the network to allocate resources based on real-time service and terminal needs Chinese vendor <b>ZTE</b> Corporation has partnered with Smartfren in Indonesia with the main aim of ...,https://www.rcrwireless.com/20240910/ai-ml/zte-smartfren-partner-native-ai-based-ran-computing,RCR Wireless News,2024-09-10T00:00:00.0000000Z
"China, Bulgaria eager to deepen business cooperation","Atanas Todorov, general manager of the Bulgarian branch of China&#39;s <b>ZTE</b>, one of the exhibitors, told Xinhua that by cooperating with local leading telecoms in Bulgaria, <b>ZTE</b> has started its first ...",http://www.china.org.cn/world/2024-09/13/content_117425777.htm,China Internet Information Center,2024-09-13T00:00:00.0000000Z
<b>ZTE</b> Blade A55 Price in Pakistan,<b>ZTE</b> is a Chinese telecommunication brand making its way into the Pakistani market. <b>ZTE</b> Blade A55 review advocates that this smartphone is very affordable while at the same time providing very good hardware capabilities. Explore <b>ZTE</b> Blade A55 specs with us ...,https://hamariweb.com/mobiles/zte/zte-blade-a55,hamariweb,2024-08-01T07:22:00.0000000Z
<b>ZTE</b> Axon 30 Ultra,"Detail lost in brightest and darkest areas in photos and videos Graininess in indoor and low-light photos and videos Significant issues with video autofocus Audio recording performance Screen&#39;s color reproduction, characterized by a very strong pink cast",https://www.dxomark.com/smartphones/ZTE/Axon-30-Ultra,DxOMark,2022-02-15T10:09:00.0000000Z
"Beyond smartphones: Dixon, Optiemus, Bhagwati eye telecom gear to drive growth",EMS companies are expanding into telecom and networking products for growth. The shift aligns with the government’s aim to make India a global telecom equipment hub through the PLI scheme,https://www.moneycontrol.com/news/telecom/beyond-smartphones-dixon-optiemus-bhagwati-eye-telecom-gear-to-drive-growth-12834642.html,moneycontrol.com,2024-10-03T07:49:00.0000000Z
<b>ZTE</b> nubia Neo 2 - user opinions and reviews,Total of 103 user reviews and opinions for <b>ZTE</b> nubia Neo 2. These are the best offers from our affiliate partners. We may get a commission from qualifying sales.,https://www.gsmarena.com/zte_nubia_neo_2-reviews-12852.php,GSM Arena,2024-09-11T23:59:00.0000000Z
DITO vs Smart – who has the better affordable 5G smartphone?,"Both DITO and Smart have released their budget-oriented smartphones. The two are priced well below the PhP 6,000 mark. But which one has the better",https://hungrygeeks.com.ph/dito-vs-smart-who-has-the-better-affordable-5g-smartphone/,hungrygeeks,2024-10-09T01:44:00.0000000Z
Michael O’Neill faces goalkeeping crisis as first choice shot-stopper drops out of Northern Ireland’s Nations League squad,Michael O’Neill will be without goalkeeper Bailey Peacock-Farrell for the upcoming Nations League matches against Belarus and Bulgaria due to a shoulder injury.,https://www.belfasttelegraph.co.uk/sport/football/international/michael-oneill-faces-goalkeeping-crisis-as-first-choice-shot-stopper-drops-out-of-northern-irelands-nations-league-squad/a990499642.html,Belfast Telegraph,2024-10-07T15:27:00.0000000Z
<b>ZTE</b> Launches Industry-Leading 440M Ultra-Broadband AAU At ICTWEEK-2024,"ZTE Corporation a global leading provider of integrated information and communication technology solutions, has launched the industry-leading dual-band 440M ultra-broadband AAU at ICTWEEK-2024.",https://www.wirelessnetworksonline.com/doc/zte-launches-industry-leading-m-ultra-broadband-aau-at-ictweek-0001,wirelessnetworksonline.com,2024-10-07T08:37:00.0000000Z
Global Media Gateway Market Overview And Statistics For 2024-2033,The Business Research Company&#39;s Global media Gateway Market Overview And Statistics For 2024-2033,https://menafn.com/1108748006/Global-Media-Gateway-Market-Overview-And-Statistics-For-2024-2033,Mena FN,2024-10-04T21:49:00.0000000Z
I wouldn’t hesitate to give Pierce Charles his senior Northern Ireland debut: Michael O’Neill,"Northern Ireland will work at Stockport County’s training ground at Carrington until Thursday when they jet out to Hungary to prepare for the weekend game against Belarus at the neutral <b>ZTE</b> Arena in Zalaegerszeg. Meanwhile, O’Neill is convinced that ...",https://www.belfasttelegraph.co.uk/sport/football/international/i-wouldnt-hesitate-to-give-pierce-charles-his-senior-northern-ireland-debut-michael-oneill/a1813613053.html,Belfast Telegraph,2024-10-07T00:00:00.0000000Z
<b>ZTE Zpad</b> Specs,"The <b>ZTE Zpad</b> features a 10.1-inch FHD display, Snapdragon octa-core processor, 2GB of RAM and 16GB of internal storage (expandable via microSD card). The tablet is LTE enabled and is powered by 9070mAh battery.",https://www.phonearena.com/phones/ZTE-Zpad_id10428,PhoneArena,2017-02-07T12:00:00.0000000Z
MTN and <b>ZTE</b> achieve Africa&#39;s first 5G ultra-range maritime coverage in South Africa,"MTN South Africa and ZTE Corporation, a global provider of integrated information and communication technology solutions, have announced Africa&#39;s first 5G ultra-range maritime offshore coverage at Mossel Bay,",https://africabusinesscommunities.com/tech-24/mtn-and-zte-achieve-africas-first-5g-ultra-range-maritime-coverage-in-south-africa/,africabusinesscommunities.com,2024-09-27T10:00:00.0000000Z
"US bans sale of Huawei, <b>ZTE</b> tech amid security fears","The US has banned the sale and import of new communications equipment from five Chinese companies, including Huawei and <b>ZTE</b>, amid concerns over national security. Other companies listed include ...",https://www.bbc.com/news/world-us-canada-63764450,BBC,2022-11-26T12:10:00.0000000Z
How to take a <b>screenshot on any ZTE smartphone and find the image</b> later,"Thankfully, it&#39;s easy to do on any <b>ZTE</b> phone, as well as most handsets from other Android brands. <b>ZTE</b> has embraced the standard method of taking a screenshot that most Android phones share.",https://www.businessinsider.in/tech/how-to/how-to-take-a-screenshot-on-any-zte-smartphone-and-find-the-image-later/articleshow/77425014.cms,Business Insider India,2020-08-07T23:34:00.0000000Z
Easy Setup Guide - <b>ZTE</b> MF28B,"Open the protective cover of the SIM port shown below and insert the SIM card. Please power off the MF28B router and remove the external power adapter before removing or inserting the SIM card. If not, the router or SIM card may be damaged. Turn the Power ...",https://www.rogers.com/support/mobility/easy-setup-guide-zte-mf28b,Rogers,2022-11-30T22:51:00.0000000Z
<b>ZTE Altair 2</b> Specs,"The <b>ZTE Altair 2</b> is a messaging phone with a full QWERTY keyboard, 2.4-inch display, 2-megapixel camera, Bluetooth and a microSD card slot.",https://www.phonearena.com/phones/ZTE-Altair-2_id8988,PhoneArena,2014-11-06T13:33:00.0000000Z
<b>Huawei and ZTE left out of India</b>&#39;s 5G trials,"India&#39;s telecom ministry has left out Chinese equipment makers Huawei and <b>ZTE</b> from its 5G trials, becoming the latest country to lock the firms out. The ministry granted permission to a dozen ...",https://www.bbc.com/news/business-56990236,BBC,2023-12-11T05:26:00.0000000Z
