Title,Description,URL,Provider,Date Published
Zalaegerszeg vs Ujpest Prediction: Both sides expected to score,"Zalaegerszeg will host Ujpest on Sunday at the ZTE Aréna. Ujpest remained unbeaten in all competitions in the last five games. Can they continue this run? Below are previews, head-to-head statistics,",https://www.telecomasia.net/sports-betting/tips/football/hungary-nb-i-zalaegerszeg-vs-ujpest-prediction-betting-tips-odds-06-october-2024/,telecomasia.net,2024-10-05T09:37:00.0000000Z
Looking to the next four years: strengthening America’s space leadership,"Since the dawn of the space age, 14 successive United States presidents have been committed to developing space for the betterment of humankind and to advance our national interests. Today, the",https://spacenews.com/looking-next-four-years-strengthening-americas-space-leadership/,SpaceNews,2024-10-07T13:00:00.0000000Z
<b>ZTE</b>’s Summer Chen: A Digital Future for All,"At the United Nations Summit of the Future 2024 in New York  on 21 September, ZTE Vice President Summer Chen delivered a keynote speech “A Digital Future for All” during ITU’s SDG DIGITAL on how ZTE’s solutions are able to provide connectivity in some of the world’s least developed countries as well as some of its most remote regions.",https://developingtelecoms.com/telecom-business/vendor-news/17362-zte-s-summer-chen-a-digital-future-for-all.html,developingtelecoms.com,2024-09-25T16:35:00.0000000Z
<b>ZTE Z557</b>,"<b>ZTE</b>’s latest addition to its phone is <b>ZTE Z557</b>. The smartphone comes with a display of screen size 5.0 inches IPS, Full HD+ with 480 x 854 Pixels resolution. The smartphone is powered by ...",https://www.gizmochina.com/product/zte-z557/,Gizmochina,2019-04-14T16:17:00.0000000Z
<b>ZTE</b> pairs with China Telecom for 5G smart hospital,"ZTE Corporation has paired with China Telecom to deploy a 5G IoT integration network at The First Affiliated Hospital of Soochow University in Suzhou, China.",https://www.datacenterdynamics.com/en/news/zte-pairs-with-china-telecom-for-5g-smart-hospital/,Datacenter Dynamics,2024-10-01T13:41:00.0000000Z
Gartner’s Top 10 <b>Global 5G Network Infrastructure Companies</b>,"<b>ZTE</b> has a strong telecommunications products line covering wireless and wired infrastructure, core networks, software systems and services, and Internet of Things. <b>ZTE</b>’s large 5G portfolio ...",https://www.crn.com/slide-shows/networking/gartner-s-top-10-global-5g-network-infrastructure-companies,CRN,2021-03-26T18:09:00.0000000Z
Where are Samsung phones designed and made? The answer might surprise you,"Given its success so far, Samsung will likely invest more here in the future. Are <b>ZTE</b> phones made by Samsung? No, <b>ZTE</b> phones are not made by Samsung. <b>ZTE</b> is a partially state-owned Chinese ...",https://www.androidauthority.com/where-are-samsung-phones-made-3251712/,Android Authority,2024-09-20T00:00:00.0000000Z
<b>ZTE</b> strengthens commitment to advancing a sustainable digital future for all at UN Summit of the Future,<b>ZTE</b> Vice President Summer Chen was invited to deliver a keynote speech at SDG Digital &quot;A Digital Future for All&quot; at United Nations Headquarters <b>ZTE</b> reinforces its strong commitment to advancing meaningful global connectivity and digital transformation ...,https://www.asiaone.com/business/zte-strengthens-commitment-advancing-sustainable-digital-future-all-un-summit-future,Asia One,2024-09-26T04:40:00.0000000Z
{Hot Stocks}2 listed firms see price swing at 10:43am,"Copyright 2024 ET Net Limited. http://www.etnet.com.hk ET Net Limited, HKEx Information Services Limited, its Holding Companies and/or any Subsidiaries of such ...",https://www.etnet.com.hk/www/eng/warrants/realtime/quote_news_detail.php?newsid=ETE341007483&code=52312,經濟通ET Net,2024-10-07T07:14:00.0000000Z
Releases: ipatrina/<b>ZTE</b>-Patrina,1.增加中兴(<b>ZTE</b>)光终端XML、CFG格式配置文件Indiv密钥(一机一密)解密支持。 2.增加中兴(<b>ZTE</b>)光终端新hardcode文件解密支持。 3.增加软件License(授权使用)功能。 4.增加DPI合规性检测。,https://github.com/ipatrina/ZTE-Patrina/releases,GitHub,2024-04-16T08:13:00.0000000Z
This USB-C dock with dual 4K monitor support is 72% off for Prime Day,"This Kensington USB-C dock comes with tons of ports and support for double 4K monitors, and it’s shockingly cheap at $49.62 for Prime Day on Amazon right now. That’s less than a third of its $180 retail price.",https://www.msn.com/en-us/news/other/this-usb-c-dock-with-dual-4k-monitor-support-is-72-off-for-prime-day/ar-AA1rU1j8,PC World on MSN.com,2024-10-08T15:37:19.0000000Z
<b>ZTE ZMax</b>,"Detailed features and specs for the <b>ZTE ZMax</b> for Metro, T-Mobile. Plus discussion forum and photos This affordable large-screen Android phone sports a 5.7-inch display and large 3,400 mAh battery.",https://www.phonescoop.com/phones/phone.php?p=4551,Phone Scoop,2024-10-07T00:00:00.0000000Z
<b>ZTE C79</b>,"This mass-market clamshell CDMA phone is <b>ZTE</b>&#39;s first with CDMA 1700 to support AWS networks. Similar to the C88 in many ways, it adds a music player with external controls, memory card slot ...",https://www.phonescoop.com/phones/phone.php?p=1514,Phone Scoop,2024-10-05T00:00:00.0000000Z
Gone Are the Days of Networking Infrastructure Choice,"For example, in the past, networking vendors retired their controllerless product lines in favor of controller-based ones. To actually deliver on choice, customers expect to be able to choose solutions with all things being equal, such as support, longevity, future feature enhancement, etc., between the product lines.",https://www.cdotrends.com/story/4244/gone-are-days-networking-infrastructure-choice,cdotrends,2024-10-07T05:19:00.0000000Z
The HTTPD binary in multiple <b>ZTE</b> routers has a stack...,This score calculates overall vulnerability severity from 0 to 10 and is based on the Common Vulnerability Scoring System (CVSS). Attack vector: More severe the more the remote (logically and physically) an attacker can be in order to exploit the ...,https://github.com/advisories/GHSA-68ww-7h9f-48qx,GitHub,2024-09-16T00:00:00.0000000Z
<b>ZTE</b> honors outstanding students with PH scholarship program,"METRO MANILA, PHILIPPINES – <b>ZTE</b> Corporation, a global leading ICT solutions provider, announced the launch of its first-ever scholarship program in the Philippines. It recognized six exceptional ...",https://technology.inquirer.net/136977/zte-honors-outstanding-students-with-ph-scholarship-program,Philippine Daily Inquirer,2024-09-11T08:18:00.0000000Z
